2025.01.06,Beans Brown (Oloyin),Grains,Lagos (Lekki),4500,-2,0,3200,80,Yes,5000
07-01-2025,Power Oil (Sachet),Oils,Abuja,500,26,13000,400,101,No,50000
2025.01.07,Peak Milk 400g,Dairy,Enugu,5800,21,121800,4900,28,Yes,0
07/01/2025,Yam Tuber (Large),Produce,Lagos (Lekki),12000,10,120000,8000,86,Yes,5000
07-01-2025,Yam Tuber (Large),Produce,Enugu,12000,26,312000,8000,26,No,5000
"Jan 08, 25",Yellow Garri (Paint),Tubers,Abuja,5500,28,154000,4200,44,No,0
08/01/2025,Beans Brown (Oloyin),Grains,Enugu,4500,6,27000,3200,36,No,50000
2025.01.08,Kings Oil 5L,Oils,Kano,NGN 27000,-1,0,21500,35,No,10000
2025.01.08,Local Rice (50kg),Grains,Kano,120000,16,1920000,105000,109,No,50000
09/01/2025,Indomie Super Pack,Noodles,Enugu,20000,30,600000,16800,182,Yes,0
09-01-2025,Dangote Sugar 1kg,Sweeteners,Enugu,4000,25,100000,3200,195,Yes,5000
2025-01-09,Peak Milk 400g,Dairy,Port Harcourt,5800,26,150800,4900,80,Yes,0
09/01/2025,Beans Brown (Oloyin),Grains,Abuja,Promo Price: 4000,9,40500,3200,93,Yes,0
2025-01-10,Semovita 10kg,Swallow,Lagos (Ikeja),Promo Price: 10000,10,105000,9200,177,No,50000
"Jan 10, 25",Semovita 10kg,Swallow,Lagos (Ikeja),10500,0,0,9200,137,No,50000
2025.01.10,Frozen Turkey (kg),Meat,Enugu,11000,11,121000,8800,94,No,0
10/01/2025,Milo Refill 500g,Beverages,Ibadan,7200,13,93600,6000,32,Yes,0
"Jan 11, 25",Yellow Garri (Paint),Tubers,Lagos (Lekki),5500,0,0,4200,135,No,0
2025-01-11,Frozen Turkey (kg),Meat,Abuja,Promo Price: 10500,16,176000,8800,34,No,0
11-01-2025,Yam Tuber (Large),Produce,Lagos (Ikeja),NGN 12000,19,228000,8000,188,No,50000
11/01/2025,Yellow Garri (Paint),Tubers,Lagos (Ikeja),5500,-1,0,4200,103,No,10000
2025-01-12,Indomie Super Pack,Noodles,Lagos (Ikeja),20000,8,160000,16800,49,No,0
"Jan 12, 25",Yam Tuber (Large),Produce,Enugu,12000,21,252000,8000,182,Yes,0
12/01/2025,Semovita 10kg,Swallow,Port Harcourt,10500,1,10500,9200,184,Yes,50000
"Jan 12, 25",Semovita 10kg,Swallow,Port Harcourt,10500,21,220500,9200,73,Yes,10000
"Jan 13, 25",Frozen Turkey (kg),Meat,Abuja,11000,9,99000,8800,184,No,50000
13/01/2025,Yam Tuber (Large),Produce,Enugu,12000,28,336000,8000,189,No,0
13-01-2025,Milo Refill 500g,Beverages,Port Harcourt,7200,8,57600,6000,65,Yes,5000
"Jan 13, 25",Kings Oil 5L,Oils,Kano,27000,18,486000,21500,54,Yes,0
2025.01.14,Kings Oil 5L,Oils,Abuja,27000,6,162000,21500,43,Yes,50000
2025-01-14,Yellow Garri (Paint),Tubers,Ibadan,5500,23,126500,4200,44,No,5000
2025.01.14,Semovita 10kg,Swallow,Lagos (Lekki),NGN 10500,29,304500,9200,59,No,0
14-01-2025,Dangote Sugar 1kg,Sweeteners,Lagos (Lekki),4000,7,28000,3200,60,No,0
"Jan 15, 25",Peak Milk 400g,Dairy,Kano,5800,7,40600,4900,99,Yes,0
15-01-2025,Yam Tuber (Large),Produce,Lagos (Ikeja),12000,20,240000,8000,86,No,0
2025-01-15,Milo Refill 500g,Beverages,Enugu,7200,16,115200,6000,25,No,10000
2025-01-15,Local Rice (50kg),Grains,Ibadan,120000,19,2280000,105000,102,Yes,0
16/01/2025,Yam Tuber (Large),Produce,Port Harcourt,12000,26,312000,8000,127,No,10000
16-01-2025,Local Rice (50kg),Grains,Ibadan,120000,6,720000,105000,42,Yes,0
16-01-2025,Power Oil (Sachet),Oils,Port Harcourt,500,28,14000,400,193,Yes,0
16-01-2025,Frozen Turkey (kg),Meat,Kano,11000,7,77000,8800,124,No,10000
2025-01-17,Kings Oil 5L,Oils,Kano,27000,25,675000,21500,146,Yes,0
17/01/2025,Dangote Sugar 1kg,Sweeteners,Enugu,4000,19,76000,3200,173,No,50000
"Jan 17, 25",Power Oil (Sachet),Oils,Port Harcourt,500,28,14000,400,70,No,10000
17-01-2025,Local Rice (50kg),Grains,Enugu,120000,18,2160000,105000,136,Yes,5000
"Jan 18, 25",Kings Oil 5L,Oils,Ibadan,27000,30,810000,21500,124,Yes,5000
18-01-2025,Milo Refill 500g,Beverages,Lagos (Lekki),7200,4,28800,6000,110,No,50000
2025-01-18,Power Oil (Sachet),Oils,Port Harcourt,500,6,3000,400,148,Yes,50000
18-01-2025,Power Oil (Sachet),Oils,Enugu,500,6,3000,400,25,No,10000
19/01/2025,Kings Oil 5L,Oils,Lagos (Lekki),27000,8,216000,21500,60,No,5000
2025-01-19,Yam Tuber (Large),Produce,Lagos (Ikeja),12000,23,276000,8000,29,No,10000
19/01/2025,Semovita 10kg,Swallow,Enugu,10500,24,252000,9200,123,No,50000
2025-01-19,Indomie Super Pack,Noodles,Ibadan,20000,3,60000,16800,170,Yes,5000
"Jan 20, 25",Yellow Garri (Paint),Tubers,Enugu,5500,24,132000,4200,10,No,5000
20/01/2025,Yellow Garri (Paint),Tubers,Enugu,Promo Price: 5000,8,44000,4200,104,No,5000
2025-01-20,Frozen Turkey (kg),Meat,Ibadan,11000,7,77000,8800,192,No,0
"Jan 20, 25",Beans Brown (Oloyin),Grains,Ibadan,4500,15,67500,3200,197,No,0
"Jan 21, 25",Yellow Garri (Paint),Tubers,Enugu,5500,19,104500,4200,20,No,5000
21/01/2025,Power Oil (Sachet),Oils,Port Harcourt,500,1,500,400,10,No,0
21-01-2025,Indomie Super Pack,Noodles,Kano,20000,29,580000,16800,118,Yes,5000
21/01/2025,Kings Oil 5L,Oils,Ibadan,27000,22,594000,21500,84,No,0
22-01-2025,Kings Oil 5L,Oils,Lagos (Ikeja),27000,-2,0,21500,14,Yes,5000
2025-01-22,Beans Brown (Oloyin),Grains,Lagos (Ikeja),4500,8,36000,3200,71,No,0
22/01/2025,Yellow Garri (Paint),Tubers,Port Harcourt,Promo Price: 5000,22,121000,4200,22,No,10000
"Jan 22, 25",Frozen Turkey (kg),Meat,Abuja,11000,26,286000,8800,123,Yes,5000
23/01/2025,Local Rice (50kg),Grains,Port Harcourt,120000,2,240000,105000,54,Yes,0
2025.01.23,Semovita 10kg,Swallow,Abuja,10500,17,178500,9200,32,No,0
23-01-2025,Milo Refill 500g,Beverages,Lagos (Ikeja),Promo Price: 6700,5,36000,6000,131,No,0
"Jan 23, 25",Semovita 10kg,Swallow,Ibadan,10500,27,283500,9200,58,No,0
24-01-2025,Milo Refill 500g,Beverages,Lagos (Lekki),7200,18,129600,6000,96,No,5000
2025.01.24,Milo Refill 500g,Beverages,Lagos (Lekki),7200,14,100800,6000,76,No,0
24-01-2025,Peak Milk 400g,Dairy,Port Harcourt,5800,24,139200,4900,101,No,10000
24-01-2025,Power Oil (Sachet),Oils,Lagos (Lekki),500,1,500,400,193,No,0
"Jan 25, 25",Indomie Super Pack,Noodles,Enugu,20000,5,100000,16800,143,Yes,0
25/01/2025,Local Rice (50kg),Grains,Kano,120000,23,2760000,105000,74,Yes,50000
2025-01-25,Milo Refill 500g,Beverages,Lagos (Ikeja),7200,10,72000,6000,172,No,50000
2025.01.25,Milo Refill 500g,Beverages,Ibadan,7200,30,216000,6000,49,No,5000
26/01/2025,Semovita 10kg,Swallow,Lagos (Ikeja),10500,2,21000,9200,85,No,5000
26-01-2025,Dangote Sugar 1kg,Sweeteners,Enugu,4000,27,108000,3200,55,No,0
2025-01-26,Indomie Super Pack,Noodles,Ibadan,20000,10,200000,16800,83,No,0
26/01/2025,Beans Brown (Oloyin),Grains,Ibadan,4500,16,72000,3200,79,No,10000
"Jan 27, 25",Dangote Sugar 1kg,Sweeteners,Ibadan,4000,26,104000,3200,166,No,5000
2025.01.27,Semovita 10kg,Swallow,Abuja,Promo Price: 10000,22,231000,9200,63,No,5000
"Jan 27, 25",Power Oil (Sachet),Oils,Enugu,500,10,5000,400,111,No,0
"Jan 27, 25",Milo Refill 500g,Beverages,Lagos (Ikeja),7200,0,0,6000,177,No,0
2025-01-28,Frozen Turkey (kg),Meat,Kano,11000,8,88000,8800,197,No,0
"Jan 28, 25",Kings Oil 5L,Oils,Port Harcourt,27000,7,189000,21500,132,No,0
2025-01-28,Milo Refill 500g,Beverages,Lagos (Lekki),7200,1,7200,6000,143,Yes,0
28-01-2025,Yam Tuber (Large),Produce,Abuja,12000,8,96000,8000,181,Yes,50000
29-01-2025,Yellow Garri (Paint),Tubers,Lagos (Lekki),5500,26,143000,4200,79,No,10000
2025-01-29,Local Rice (50kg),Grains,Abuja,Promo Price: 119500,25,3000000,105000,38,No,10000
2025-01-29,Beans Brown (Oloyin),Grains,Abuja,4500,2,9000,3200,129,No,0
2025-01-29,Frozen Turkey (kg),Meat,Abuja,11000,13,143000,8800,135,Yes,50000
30/01/2025,Milo Refill 500g,Beverages,Enugu,7200,11,79200,6000,108,No,50000
"Jan 30, 25",Power Oil (Sachet),Oils,Abuja,NGN 500,15,7500,400,27,No,0
30-01-2025,Local Rice (50kg),Grains,Enugu,120000,0,0,105000,140,Yes,10000
30/01/2025,Yellow Garri (Paint),Tubers,Lagos (Lekki),5500,10,55000,4200,194,No,50000
2025-01-31,Power Oil (Sachet),Oils,Kano,500,29,14500,400,53,No,50000
2025.01.31,Local Rice (50kg),Grains,Abuja,120000,24,2880000,105000,36,Yes,0
2025-01-31,Frozen Turkey (kg),Meat,Lagos (Ikeja),11000,-1,0,8800,131,No,50000
2025.01.31,Kings Oil 5L,Oils,Port Harcourt,27000,30,810000,21500,44,No,50000
2025-02-01,Frozen Turkey (kg),Meat,Kano,11000,21,231000,8800,162,No,0
01/02/2025,Power Oil (Sachet),Oils,Lagos (Lekki),500,-2,0,400,48,No,0
"Feb 01, 25",Yellow Garri (Paint),Tubers,Ibadan,5500,8,44000,4200,35,No,5000
01/02/2025,Frozen Turkey (kg),Meat,Kano,11000,6,66000,8800,72,Yes,5000
2025.02.02,Dangote Sugar 1kg,Sweeteners,Lagos (Ikeja),4000,27,108000,3200,21,No,50000
2025-02-02,Peak Milk 400g,Dairy,Lagos (Lekki),NGN 5800,6,34800,4900,162,No,0
2025-02-02,Indomie Super Pack,Noodles,Lagos (Ikeja),20000,17,340000,16800,67,No,10000
2025-02-02,Beans Brown (Oloyin),Grains,Port Harcourt,NGN 4500,28,126000,3200,27,No,5000
"Feb 03, 25",Yellow Garri (Paint),Tubers,Kano,5500,16,88000,4200,22,No,10000
"Feb 03, 25",Beans Brown (Oloyin),Grains,Enugu,4500,4,18000,3200,38,Yes,50000
2025-02-03,Dangote Sugar 1kg,Sweeteners,Lagos (Lekki),4000,11,44000,3200,156,No,0
03-02-2025,Peak Milk 400g,Dairy,Lagos (Ikeja),5800,30,174000,4900,139,No,50000
"Feb 04, 25",Local Rice (50kg),Grains,Lagos (Lekki),120000,6,720000,105000,125,Yes,10000
2025-02-04,Kings Oil 5L,Oils,Enugu,27000,15,405000,21500,196,No,5000
04-02-2025,Power Oil (Sachet),Oils,Enugu,500,11,5500,400,138,Yes,50000
2025-02-04,Semovita 10kg,Swallow,Ibadan,10500,-1,0,9200,72,No,0
2025.02.05,Yellow Garri (Paint),Tubers,Enugu,5500,0,0,4200,80,No,0
2025-02-05,Yam Tuber (Large),Produce,Enugu,12000,-2,0,8000,21,No,5000
2025-02-05,Yellow Garri (Paint),Tubers,Port Harcourt,5500,15,82500,4200,112,No,0
2025.02.05,Peak Milk 400g,Dairy,Enugu,5800,-1,0,4900,187,No,0
06/02/2025,Dangote Sugar 1kg,Sweeteners,Ibadan,4000,23,92000,3200,12,Yes,0
06/02/2025,Beans Brown (Oloyin),Grains,Abuja,Promo Price: 4000,-2,0,3200,67,Yes,0
2025-02-06,Semovita 10kg,Swallow,Enugu,10500,10,105000,9200,28,Yes,0
06/02/2025,Kings Oil 5L,Oils,Enugu,27000,9,243000,21500,96,No,0
07/02/2025,Indomie Super Pack,Noodles,Lagos (Ikeja),20000,27,540000,16800,96,No,0
2025.02.07,Dangote Sugar 1kg,Sweeteners,Ibadan,4000,0,0,3200,39,No,10000
"Feb 07, 25",Dangote Sugar 1kg,Sweeteners,Kano,Promo Price: 3500,29,116000,3200,189,No,0
07/02/2025,Milo Refill 500g,Beverages,Port Harcourt,7200,22,158400,6000,59,No,0
08-02-2025,Yellow Garri (Paint),Tubers,Lagos (Ikeja),5500,3,16500,4200,151,No,10000
2025-02-08,Milo Refill 500g,Beverages,Lagos (Ikeja),7200,25,180000,6000,39,Yes,0
08/02/2025,Local Rice (50kg),Grains,Enugu,120000,9,1080000,105000,122,No,0
08-02-2025,Indomie Super Pack,Noodles,Enugu,20000,0,0,16800,85,No,5000
09/02/2025,Power Oil (Sachet),Oils,Lagos (Ikeja),500,27,13500,400,180,No,10000
2025.02.09,Milo Refill 500g,Beverages,Enugu,7200,23,165600,6000,82,No,0
2025.02.09,Local Rice (50kg),Grains,Lagos (Ikeja),120000,25,3000000,105000,152,Yes,10000
09/02/2025,Semovita 10kg,Swallow,Enugu,10500,7,73500,9200,128,Yes,0
10/02/2025,Semovita 10kg,Swallow,Port Harcourt,10500,13,136500,9200,135,No,5000
"Feb 10, 25",Yam Tuber (Large),Produce,Ibadan,12000,10,120000,8000,22,No,50000
2025.02.10,Yam Tuber (Large),Produce,Enugu,NGN 12000,23,276000,8000,176,No,50000
10-02-2025,Kings Oil 5L,Oils,Port Harcourt,27000,12,324000,21500,158,No,0
11-02-2025,Milo Refill 500g,Beverages,Kano,NGN 7200,3,21600,6000,118,Yes,50000
2025-02-11,Semovita 10kg,Swallow,Enugu,10500,5,52500,9200,196,Yes,10000
11/02/2025,Local Rice (50kg),Grains,Abuja,120000,26,3120000,105000,82,No,0
11-02-2025,Local Rice (50kg),Grains,Lagos (Ikeja),120000,24,2880000,105000,127,No,5000
2025-02-12,Indomie Super Pack,Noodles,Lagos (Lekki),20000,22,440000,16800,104,No,10000
12/02/2025,Local Rice (50kg),Grains,Kano,120000,30,3600000,105000,51,No,0
"Feb 12, 25",Yellow Garri (Paint),Tubers,Ibadan,5500,24,132000,4200,119,Yes,5000
"Feb 12, 25",Yellow Garri (Paint),Tubers,Ibadan,NGN 5500,13,71500,4200,157,Yes,5000
13/02/2025,Local Rice (50kg),Grains,Lagos (Lekki),120000,16,1920000,105000,120,No,10000
2025-02-13,Yam Tuber (Large),Produce,Abuja,12000,23,276000,8000,116,No,5000
2025-02-13,Yellow Garri (Paint),Tubers,Kano,5500,17,93500,4200,29,No,50000
13/02/2025,Milo Refill 500g,Beverages,Kano,7200,11,79200,6000,134,No,50000
14-02-2025,Beans Brown (Oloyin),Grains,Port Harcourt,4500,23,103500,3200,165,No,0
14-02-2025,Beans Brown (Oloyin),Grains,Lagos (Ikeja),4500,-2,0,3200,17,Yes,0
2025.02.14,Peak Milk 400g,Dairy,Enugu,5800,1,5800,4900,56,No,0
"Feb 14, 25",Milo Refill 500g,Beverages,Enugu,7200,10,72000,6000,163,No,50000
15-02-2025,Indomie Super Pack,Noodles,Port Harcourt,20000,12,240000,16800,26,No,50000
2025.02.15,Indomie Super Pack,Noodles,Enugu,20000,13,260000,16800,191,No,0
"Feb 15, 25",Dangote Sugar 1kg,Sweeteners,Enugu,4000,30,120000,3200,69,No,5000
"Feb 15, 25",Power Oil (Sachet),Oils,Lagos (Lekki),500,6,3000,400,150,No,5000
"Feb 16, 25",Semovita 10kg,Swallow,Port Harcourt,10500,7,73500,9200,51,No,5000
"Feb 16, 25",Peak Milk 400g,Dairy,Abuja,5800,9,52200,4900,51,No,5000
16/02/2025,Beans Brown (Oloyin),Grains,Enugu,4500,13,58500,3200,104,No,50000
16/02/2025,Kings Oil 5L,Oils,Enugu,NGN 27000,3,81000,21500,13,Yes,0
17/02/2025,Yam Tuber (Large),Produce,Ibadan,12000,7,84000,8000,81,No,5000
2025.02.17,Kings Oil 5L,Oils,Abuja,27000,30,810000,21500,111,No,0
2025-02-17,Semovita 10kg,Swallow,Port Harcourt,10500,20,210000,9200,18,Yes,50000
17-02-2025,Milo Refill 500g,Beverages,Kano,Promo Price: 6700,15,108000,6000,93,No,0
2025.02.18,Beans Brown (Oloyin),Grains,Enugu,4500,19,85500,3200,188,No,0
18-02-2025,Frozen Turkey (kg),Meat,Lagos (Ikeja),11000,20,220000,8800,100,No,0
2025-02-18,Indomie Super Pack,Noodles,Abuja,20000,14,280000,16800,69,Yes,0
2025.02.18,Indomie Super Pack,Noodles,Lagos (Ikeja),20000,11,220000,16800,89,No,0
19-02-2025,Kings Oil 5L,Oils,Abuja,27000,23,621000,21500,136,Yes,0
"Feb 19, 25",Power Oil (Sachet),Oils,Lagos (Ikeja),500,14,7000,400,73,Yes,50000
"Feb 19, 25",Power Oil (Sachet),Oils,Abuja,500,5,2500,400,148,Yes,0
2025-02-19,Peak Milk 400g,Dairy,Kano,5800,28,162400,4900,30,Yes,50000
20-02-2025,Beans Brown (Oloyin),Grains,Lagos (Ikeja),4500,25,112500,3200,30,No,50000
2025-02-20,Power Oil (Sachet),Oils,Abuja,500,8,4000,400,50,No,50000
2025-02-20,Beans Brown (Oloyin),Grains,Port Harcourt,4500,18,81000,3200,109,No,0
2025.02.20,Indomie Super Pack,Noodles,Ibadan,20000,9,180000,16800,22,No,5000
"Feb 21, 25",Frozen Turkey (kg),Meat,Ibadan,11000,22,242000,8800,196,No,50000
21-02-2025,Kings Oil 5L,Oils,Abuja,27000,2,54000,21500,72,No,10000
"Feb 21, 25",Semovita 10kg,Swallow,Kano,10500,-1,0,9200,81,No,10000
21/02/2025,Indomie Super Pack,Noodles,Port Harcourt,20000,11,220000,16800,101,No,50000
22-02-2025,Kings Oil 5L,Oils,Enugu,27000,24,648000,21500,166,No,0
2025.02.22,Frozen Turkey (kg),Meat,Abuja,11000,9,99000,8800,175,No,0
"Feb 22, 25",Dangote Sugar 1kg,Sweeteners,Ibadan,4000,18,72000,3200,186,No,10000
22-02-2025,Power Oil (Sachet),Oils,Abuja,500,16,8000,400,144,No,50000
"Feb 23, 25",Frozen Turkey (kg),Meat,Enugu,11000,20,220000,8800,70,No,0
23-02-2025,Kings Oil 5L,Oils,Ibadan,27000,18,486000,21500,50,No,10000
23-02-2025,Dangote Sugar 1kg,Sweeteners,Kano,4000,19,76000,3200,97,No,10000
23/02/2025,Yam Tuber (Large),Produce,Abuja,12000,7,84000,8000,17,No,10000
2025.02.24,Local Rice (50kg),Grains,Port Harcourt,120000,11,1320000,105000,113,No,0
2025-02-24,Indomie Super Pack,Noodles,Enugu,20000,10,200000,16800,61,Yes,5000
2025-02-24,Kings Oil 5L,Oils,Kano,27000,25,675000,21500,62,No,0
2025.02.24,Peak Milk 400g,Dairy,Lagos (Lekki),5800,20,116000,4900,65,Yes,50000
25-02-2025,Local Rice (50kg),Grains,Lagos (Lekki),120000,6,720000,105000,105,No,50000
2025.02.25,Peak Milk 400g,Dairy,Enugu,NGN 5800,19,110200,4900,27,No,10000
25-02-2025,Yam Tuber (Large),Produce,Enugu,NGN 12000,6,72000,8000,31,No,0
2025-02-25,Peak Milk 400g,Dairy,Ibadan,5800,1,5800,4900,11,No,50000
2025.02.26,Semovita 10kg,Swallow,Enugu,10500,7,73500,9200,177,No,0
26-02-2025,Beans Brown (Oloyin),Grains,Port Harcourt,Promo Price: 4000,1,4500,3200,86,No,5000
2025-02-26,Milo Refill 500g,Beverages,Abuja,NGN 7200,24,172800,6000,173,No,10000
2025.02.26,Peak Milk 400g,Dairy,Ibadan,5800,-1,0,4900,44,No,10000
2025-02-27,Semovita 10kg,Swallow,Ibadan,10500,8,84000,9200,175,No,0
27/02/2025,Kings Oil 5L,Oils,Enugu,27000,18,486000,21500,74,Yes,50000
2025.02.27,Local Rice (50kg),Grains,Enugu,120000,21,2520000,105000,44,Yes,10000
"Feb 27, 25",Yam Tuber (Large),Produce,Abuja,12000,9,108000,8000,165,No,50000
"Feb 28, 25",Semovita 10kg,Swallow,Lagos (Ikeja),10500,28,294000,9200,66,No,0
"Feb 28, 25",Power Oil (Sachet),Oils,Lagos (Lekki),500,18,9000,400,73,Yes,0
2025-02-28,Frozen Turkey (kg),Meat,Lagos (Ikeja),11000,22,242000,8800,102,No,50000
28/02/2025,Power Oil (Sachet),Oils,Port Harcourt,500,6,3000,400,179,No,50000
"Mar 01, 25",Indomie Super Pack,Noodles,Port Harcourt,NGN 20000,25,500000,16800,76,No,5000
"Mar 01, 25",Indomie Super Pack,Noodles,Ibadan,20000,25,500000,16800,184,No,5000
2025.03.01,Local Rice (50kg),Grains,Lagos (Lekki),NGN 120000,1,120000,105000,29,No,5000
01-03-2025,Yellow Garri (Paint),Tubers,Lagos (Ikeja),5500,-2,0,4200,38,No,5000
02-03-2025,Power Oil (Sachet),Oils,Ibadan,500,18,9000,400,172,No,5000
02-03-2025,Beans Brown (Oloyin),Grains,Ibadan,4500,24,108000,3200,198,Yes,50000
02/03/2025,Milo Refill 500g,Beverages,Kano,NGN 7200,26,187200,6000,159,Yes,10000
02-03-2025,Power Oil (Sachet),Oils,Abuja,NGN 500,7,3500,400,195,No,10000
"Mar 03, 25",Frozen Turkey (kg),Meat,Ibadan,11000,9,99000,8800,109,No,0
03-03-2025,Yellow Garri (Paint),Tubers,Lagos (Ikeja),5500,6,33000,4200,52,No,10000
03-03-2025,Peak Milk 400g,Dairy,Abuja,5800,8,46400,4900,117,No,5000
03-03-2025,Peak Milk 400g,Dairy,Kano,5800,16,92800,4900,88,No,0
2025.03.04,Power Oil (Sachet),Oils,Port Harcourt,500,19,9500,400,77,Yes,0
04-03-2025,Kings Oil 5L,Oils,Lagos (Ikeja),27000,1,27000,21500,164,No,10000
"Mar 04, 25",Frozen Turkey (kg),Meat,Ibadan,11000,12,132000,8800,63,No,0
2025.03.04,Yellow Garri (Paint),Tubers,Port Harcourt,NGN 5500,1,5500,4200,63,No,0
"Mar 05, 25",Semovita 10kg,Swallow,Lagos (Lekki),10500,29,304500,9200,190,No,0
05/03/2025,Milo Refill 500g,Beverages,Enugu,7200,30,216000,6000,176,No,10000
05-03-2025,Milo Refill 500g,Beverages,Lagos (Ikeja),Promo Price: 6700,17,122400,6000,151,No,0
2025.03.05,Power Oil (Sachet),Oils,Lagos (Lekki),500,19,9500,400,143,Yes,0
06-03-2025,Dangote Sugar 1kg,Sweeteners,Enugu,4000,7,28000,3200,156,No,10000
2025.03.06,Yam Tuber (Large),Produce,Lagos (Ikeja),12000,10,120000,8000,103,No,0
2025.03.06,Local Rice (50kg),Grains,Lagos (Ikeja),120000,18,2160000,105000,128,No,0
"Mar 06, 25",Indomie Super Pack,Noodles,Lagos (Lekki),20000,4,80000,16800,40,No,0
07/03/2025,Beans Brown (Oloyin),Grains,Enugu,4500,13,58500,3200,49,Yes,0
07/03/2025,Beans Brown (Oloyin),Grains,Lagos (Lekki),4500,0,0,3200,167,No,10000
"Mar 07, 25",Kings Oil 5L,Oils,Lagos (Ikeja),27000,21,567000,21500,183,No,5000
2025-03-07,Local Rice (50kg),Grains,Lagos (Ikeja),120000,16,1920000,105000,174,No,5000
08/03/2025,Beans Brown (Oloyin),Grains,Abuja,4500,19,85500,3200,126,Yes,10000
2025-03-08,Peak Milk 400g,Dairy,Enugu,5800,2,11600,4900,182,Yes,50000
2025-03-08,Local Rice (50kg),Grains,Lagos (Ikeja),120000,30,3600000,105000,37,No,0
08/03/2025,Local Rice (50kg),Grains,Port Harcourt,120000,22,2640000,105000,171,No,0
09-03-2025,Frozen Turkey (kg),Meat,Kano,11000,6,66000,8800,133,No,0
2025-03-09,Yam Tuber (Large),Produce,Kano,12000,30,360000,8000,32,Yes,50000
"Mar 09, 25",Beans Brown (Oloyin),Grains,Abuja,4500,15,67500,3200,176,No,0
2025-03-09,Beans Brown (Oloyin),Grains,Kano,4500,27,121500,3200,41,No,5000
10/03/2025,Frozen Turkey (kg),Meat,Enugu,11000,14,154000,8800,95,Yes,10000
"Mar 10, 25",Dangote Sugar 1kg,Sweeteners,Kano,4000,11,44000,3200,179,No,10000
2025.03.10,Peak Milk 400g,Dairy,Ibadan,5800,-1,0,4900,30,No,50000
2025.03.10,Peak Milk 400g,Dairy,Lagos (Ikeja),5800,18,104400,4900,148,No,50000
2025-03-11,Beans Brown (Oloyin),Grains,Ibadan,4500,6,27000,3200,192,No,50000
2025.03.11,Kings Oil 5L,Oils,Lagos (Ikeja),27000,17,459000,21500,135,Yes,10000
11-03-2025,Semovita 10kg,Swallow,Lagos (Lekki),NGN 10500,27,283500,9200,124,No,50000
11-03-2025,Power Oil (Sachet),Oils,Kano,500,13,6500,400,70,Yes,0
12/03/2025,Peak Milk 400g,Dairy,Kano,5800,2,11600,4900,107,No,50000
2025-03-12,Peak Milk 400g,Dairy,Ibadan,5800,15,87000,4900,33,No,0
12-03-2025,Peak Milk 400g,Dairy,Lagos (Ikeja),5800,8,46400,4900,26,Yes,0
2025-03-12,Dangote Sugar 1kg,Sweeteners,Lagos (Ikeja),4000,15,60000,3200,137,No,50000
2025-03-13,Milo Refill 500g,Beverages,Ibadan,7200,20,144000,6000,93,No,50000
2025.03.13,Yam Tuber (Large),Produce,Port Harcourt,12000,2,24000,8000,194,Yes,0
13-03-2025,Beans Brown (Oloyin),Grains,Kano,4500,27,121500,3200,88,No,0
2025-03-13,Frozen Turkey (kg),Meat,Abuja,NGN 11000,27,297000,8800,178,No,50000
14/03/2025,Kings Oil 5L,Oils,Lagos (Ikeja),27000,3,81000,21500,70,No,0
2025.03.14,Yam Tuber (Large),Produce,Port Harcourt,12000,9,108000,8000,36,No,0
"Mar 14, 25",Frozen Turkey (kg),Meat,Abuja,11000,13,143000,8800,31,No,0
2025-03-14,Yam Tuber (Large),Produce,Kano,12000,10,120000,8000,185,No,0
"Mar 15, 25",Kings Oil 5L,Oils,Lagos (Lekki),27000,-2,0,21500,164,Yes,5000
2025-03-15,Milo Refill 500g,Beverages,Abuja,Promo Price: 6700,20,144000,6000,108,No,10000
15-03-2025,Indomie Super Pack,Noodles,Port Harcourt,NGN 20000,30,600000,16800,83,No,0
2025.03.15,Milo Refill 500g,Beverages,Lagos (Ikeja),7200,17,122400,6000,70,Yes,50000
16/03/2025,Yellow Garri (Paint),Tubers,Abuja,5500,21,115500,4200,91,Yes,50000
16/03/2025,Yellow Garri (Paint),Tubers,Enugu,5500,21,115500,4200,18,No,5000
16/03/2025,Beans Brown (Oloyin),Grains,Abuja,4500,22,99000,3200,191,No,50000
"Mar 16, 25",Frozen Turkey (kg),Meat,Port Harcourt,11000,13,143000,8800,106,Yes,0
2025-03-17,Yellow Garri (Paint),Tubers,Enugu,5500,18,99000,4200,63,No,0
17/03/2025,Power Oil (Sachet),Oils,Abuja,500,-1,0,400,61,No,0
17/03/2025,Dangote Sugar 1kg,Sweeteners,Enugu,4000,-1,0,3200,101,No,0
2025-03-17,Yam Tuber (Large),Produce,Lagos (Ikeja),12000,15,180000,8000,142,Yes,50000
"Mar 18, 25",Peak Milk 400g,Dairy,Lagos (Lekki),5800,24,139200,4900,52,No,10000
2025-03-18,Frozen Turkey (kg),Meat,Enugu,11000,10,110000,8800,129,Yes,0
2025-03-18,Semovita 10kg,Swallow,Kano,10500,7,73500,9200,106,No,0
18-03-2025,Local Rice (50kg),Grains,Kano,120000,19,2280000,105000,95,No,5000
"Mar 19, 25",Milo Refill 500g,Beverages,Kano,7200,28,201600,6000,142,Yes,50000
19/03/2025,Kings Oil 5L,Oils,Abuja,27000,22,594000,21500,137,No,5000
2025.03.19,Dangote Sugar 1kg,Sweeteners,Abuja,4000,5,20000,3200,196,No,0
2025.03.19,Power Oil (Sachet),Oils,Abuja,500,14,7000,400,138,No,5000
2025.03.20,Semovita 10kg,Swallow,Abuja,10500,18,189000,9200,106,No,0
20/03/2025,Indomie Super Pack,Noodles,Lagos (Ikeja),20000,11,220000,16800,75,No,5000
"Mar 20, 25",Power Oil (Sachet),Oils,Port Harcourt,500,21,10500,400,89,No,5000
"Mar 20, 25",Milo Refill 500g,Beverages,Enugu,7200,4,28800,6000,139,No,10000
21-03-2025,Local Rice (50kg),Grains,Kano,120000,8,960000,105000,50,No,0
2025-03-21,Local Rice (50kg),Grains,Port Harcourt,Promo Price: 119500,3,360000,105000,57,No,5000
21/03/2025,Kings Oil 5L,Oils,Port Harcourt,27000,2,54000,21500,14,No,0
"Mar 21, 25",Semovita 10kg,Swallow,Lagos (Ikeja),10500,0,0,9200,81,No,5000
2025.03.22,Yellow Garri (Paint),Tubers,Lagos (Lekki),5500,7,38500,4200,184,No,50000
"Mar 22, 25",Local Rice (50kg),Grains,Port Harcourt,120000,25,3000000,105000,73,No,50000
22-03-2025,Kings Oil 5L,Oils,Lagos (Lekki),27000,14,378000,21500,116,No,0
2025.03.22,Kings Oil 5L,Oils,Ibadan,27000,0,0,21500,107,No,5000
"Mar 23, 25",Dangote Sugar 1kg,Sweeteners,Port Harcourt,4000,15,60000,3200,161,No,50000
23/03/2025,Semovita 10kg,Swallow,Lagos (Lekki),10500,8,84000,9200,41,No,5000
"Mar 23, 25",Indomie Super Pack,Noodles,Kano,20000,19,380000,16800,182,No,5000
23/03/2025,Peak Milk 400g,Dairy,Enugu,5800,1,5800,4900,160,Yes,0
2025-03-24,Dangote Sugar 1kg,Sweeteners,Enugu,4000,29,116000,3200,162,No,0
2025.03.24,Milo Refill 500g,Beverages,Lagos (Ikeja),7200,22,158400,6000,27,No,10000
2025.03.24,Frozen Turkey (kg),Meat,Enugu,11000,21,231000,8800,25,Yes,0
24-03-2025,Semovita 10kg,Swallow,Enugu,10500,22,231000,9200,59,No,50000
25/03/2025,Milo Refill 500g,Beverages,Kano,Promo Price: 6700,-2,0,6000,39,Yes,50000
"Mar 25, 25",Local Rice (50kg),Grains,Enugu,120000,17,2040000,105000,170,No,5000
25/03/2025,Yam Tuber (Large),Produce,Lagos (Lekki),12000,16,192000,8000,195,No,50000
"Mar 25, 25",Beans Brown (Oloyin),Grains,Enugu,4500,5,22500,3200,44,Yes,5000
26/03/2025,Frozen Turkey (kg),Meat,Port Harcourt,11000,19,209000,8800,144,Yes,10000
26/03/2025,Power Oil (Sachet),Oils,Kano,500,24,12000,400,174,No,10000
26-03-2025,Kings Oil 5L,Oils,Lagos (Ikeja),27000,0,0,21500,60,Yes,10000
26-03-2025,Yellow Garri (Paint),Tubers,Lagos (Lekki),5500,2,11000,4200,104,Yes,10000
27-03-2025,Power Oil (Sachet),Oils,Lagos (Lekki),500,16,8000,400,199,No,0
27-03-2025,Yellow Garri (Paint),Tubers,Lagos (Lekki),5500,18,99000,4200,198,Yes,5000
27/03/2025,Semovita 10kg,Swallow,Kano,10500,7,73500,9200,99,No,0
27-03-2025,Milo Refill 500g,Beverages,Enugu,7200,14,100800,6000,65,No,0
28-03-2025,Dangote Sugar 1kg,Sweeteners,Port Harcourt,4000,-2,0,3200,48,No,50000
28/03/2025,Frozen Turkey (kg),Meat,Port Harcourt,11000,3,33000,8800,98,No,0
28-03-2025,Frozen Turkey (kg),Meat,Enugu,11000,0,0,8800,197,Yes,0
28-03-2025,Dangote Sugar 1kg,Sweeteners,Abuja,4000,4,16000,3200,16,No,5000
2025.03.29,Semovita 10kg,Swallow,Abuja,10500,7,73500,9200,124,No,0
2025-03-29,Indomie Super Pack,Noodles,Kano,20000,17,340000,16800,164,No,5000
2025-03-29,Yellow Garri (Paint),Tubers,Abuja,5500,11,60500,4200,50,No,10000
29/03/2025,Dangote Sugar 1kg,Sweeteners,Lagos (Lekki),4000,6,24000,3200,70,No,0
2025.03.30,Frozen Turkey (kg),Meat,Lagos (Lekki),11000,14,154000,8800,124,No,0
2025.03.30,Yam Tuber (Large),Produce,Lagos (Ikeja),12000,9,108000,8000,47,No,5000
"Mar 30, 25",Yam Tuber (Large),Produce,Kano,12000,16,192000,8000,53,No,0
2025.03.30,Beans Brown (Oloyin),Grains,Enugu,4500,15,67500,3200,89,No,0
2025.03.31,Beans Brown (Oloyin),Grains,Lagos (Lekki),4500,16,72000,3200,60,No,10000
Last Friday,Frozen Turkey (kg),Meat,Abuja,NGN 11000,6,66000,8800,143,No,0
"Mar 31, 25",Indomie Super Pack,Noodles,Enugu,20000,27,540000,16800,183,Yes,5000
31-03-2025,Power Oil (Sachet),Oils,Lagos (Ikeja),500,8,4000,400,53,No,10000
"Apr 01, 25",Frozen Turkey (kg),Meat,Lagos (Ikeja),11000,14,154000,8800,32,Yes,10000
"Apr 01, 25",Beans Brown (Oloyin),Grains,Abuja,4500,0,0,3200,16,No,0
"Apr 01, 25",Semovita 10kg,Swallow,Enugu,10500,-1,0,9200,49,No,10000
01/04/2025,Local Rice (50kg),Grains,Ibadan,120000,30,3600000,105000,191,Yes,50000
"Apr 02, 25",Power Oil (Sachet),Oils,Enugu,500,-1,0,400,61,No,50000
2025-04-02,Yam Tuber (Large),Produce,Kano,12000,-1,0,8000,199,No,0
2025-04-02,Kings Oil 5L,Oils,Kano,27000,1,27000,21500,63,Yes,0
2025-04-02,Peak Milk 400g,Dairy,Port Harcourt,5800,21,121800,4900,79,Yes,10000
03/04/2025,Indomie Super Pack,Noodles,Ibadan,NGN 20000,20,400000,16800,181,No,5000
03/04/2025,Indomie Super Pack,Noodles,Ibadan,Promo Price: 19500,22,440000,16800,173,No,5000
"Apr 03, 25",Power Oil (Sachet),Oils,Port Harcourt,500,9,4500,400,30,No,0
2025-04-03,Beans Brown (Oloyin),Grains,Lagos (Ikeja),4500,17,76500,3200,62,Yes,5000
"Apr 04, 25",Beans Brown (Oloyin),Grains,Enugu,4500,14,63000,3200,163,No,5000
04/04/2025,Indomie Super Pack,Noodles,Abuja,20000,21,420000,16800,132,No,5000
2025.04.04,Kings Oil 5L,Oils,Lagos (Ikeja),27000,23,621000,21500,167,Yes,50000
04-04-2025,Kings Oil 5L,Oils,Abuja,27000,10,270000,21500,41,Yes,50000
2025.04.05,Semovita 10kg,Swallow,Kano,10500,25,262500,9200,72,No,10000
"Apr 05, 25",Peak Milk 400g,Dairy,Ibadan,5800,21,121800,4900,32,No,0
05-04-2025,Yellow Garri (Paint),Tubers,Kano,5500,7,38500,4200,192,No,5000
"Apr 05, 25",Peak Milk 400g,Dairy,Ibadan,5800,4,23200,4900,194,No,5000
06-04-2025,Power Oil (Sachet),Oils,Lagos (Ikeja),500,23,11500,400,64,No,0
06-04-2025,Power Oil (Sachet),Oils,Abuja,500,5,2500,400,21,No,5000
06/04/2025,Kings Oil 5L,Oils,Ibadan,27000,18,486000,21500,28,No,10000
"Apr 06, 25",Yellow Garri (Paint),Tubers,Kano,5500,11,60500,4200,45,Yes,0
2025.04.07,Dangote Sugar 1kg,Sweeteners,Abuja,4000,-2,0,3200,109,No,0
2025-04-07,Indomie Super Pack,Noodles,Kano,20000,15,300000,16800,86,No,0
07/04/2025,Local Rice (50kg),Grains,Ibadan,120000,-2,0,105000,52,No,50000
2025-04-07,Indomie Super Pack,Noodles,Kano,20000,12,240000,16800,95,No,5000
08/04/2025,Beans Brown (Oloyin),Grains,Ibadan,4500,24,108000,3200,14,No,10000
08/04/2025,Yellow Garri (Paint),Tubers,Lagos (Lekki),5500,5,27500,4200,106,No,5000
2025.04.08,Beans Brown (Oloyin),Grains,Kano,4500,30,135000,3200,141,Yes,10000
08-04-2025,Peak Milk 400g,Dairy,Ibadan,5800,7,40600,4900,44,Yes,50000
2025-04-09,Yam Tuber (Large),Produce,Enugu,12000,12,144000,8000,38,No,50000
Last Friday,Dangote Sugar 1kg,Sweeteners,Port Harcourt,4000,30,120000,3200,168,No,10000
"Apr 09, 25",Frozen Turkey (kg),Meat,Ibadan,11000,17,187000,8800,159,Yes,0
2025-04-09,Milo Refill 500g,Beverages,Ibadan,7200,0,0,6000,179,No,10000
10-04-2025,Milo Refill 500g,Beverages,Enugu,7200,-2,0,6000,198,No,10000
10/04/2025,Frozen Turkey (kg),Meat,Enugu,11000,-2,0,8800,65,No,10000
10-04-2025,Frozen Turkey (kg),Meat,Ibadan,11000,23,253000,8800,49,No,10000
2025-04-10,Milo Refill 500g,Beverages,Abuja,7200,-1,0,6000,26,No,0
11-04-2025,Kings Oil 5L,Oils,Lagos (Ikeja),27000,-1,0,21500,67,No,0
"Apr 11, 25",Peak Milk 400g,Dairy,Enugu,5800,26,150800,4900,18,No,50000
11-04-2025,Yellow Garri (Paint),Tubers,Kano,5500,-1,0,4200,166,No,0
"Apr 11, 25",Peak Milk 400g,Dairy,Lagos (Ikeja),5800,7,40600,4900,155,No,0
12-04-2025,Milo Refill 500g,Beverages,Kano,7200,-1,0,6000,121,No,5000
12-04-2025,Yellow Garri (Paint),Tubers,Kano,5500,4,22000,4200,114,No,10000
12-04-2025,Milo Refill 500g,Beverages,Lagos (Lekki),7200,14,100800,6000,71,No,10000
2025.04.12,Frozen Turkey (kg),Meat,Abuja,11000,26,286000,8800,173,No,5000
2025.04.13,Yellow Garri (Paint),Tubers,Abuja,5500,7,38500,4200,178,No,0
"Apr 13, 25",Yellow Garri (Paint),Tubers,Port Harcourt,Promo Price: 5000,13,71500,4200,72,No,0
2025-04-13,Semovita 10kg,Swallow,Kano,10500,4,42000,9200,154,No,10000
13/04/2025,Peak Milk 400g,Dairy,Lagos (Ikeja),5800,22,127600,4900,16,No,0
2025-04-14,Frozen Turkey (kg),Meat,Abuja,11000,24,264000,8800,63,No,0
14-04-2025,Yam Tuber (Large),Produce,Enugu,12000,14,168000,8000,28,Yes,50000
2025-04-14,Beans Brown (Oloyin),Grains,Port Harcourt,4500,23,103500,3200,197,No,5000
2025.04.14,Indomie Super Pack,Noodles,Abuja,20000,28,560000,16800,152,No,10000
"Apr 15, 25",Yam Tuber (Large),Produce,Ibadan,Promo Price: 11500,-2,0,8000,67,No,0
2025.04.15,Milo Refill 500g,Beverages,Abuja,NGN 7200,13,93600,6000,40,Yes,0
15/04/2025,Milo Refill 500g,Beverages,Port Harcourt,7200,11,79200,6000,51,Yes,5000
15-04-2025,Indomie Super Pack,Noodles,Port Harcourt,20000,18,360000,16800,40,Yes,0
"Apr 16, 25",Milo Refill 500g,Beverages,Port Harcourt,7200,2,14400,6000,11,Yes,0
16-04-2025,Semovita 10kg,Swallow,Lagos (Ikeja),10500,7,73500,9200,143,Yes,0
2025.04.16,Local Rice (50kg),Grains,Enugu,120000,-1,0,105000,169,Yes,0
Last Friday,Peak Milk 400g,Dairy,Port Harcourt,5800,1,5800,4900,180,Yes,0
2025-04-17,Beans Brown (Oloyin),Grains,Ibadan,4500,11,49500,3200,199,No,50000
"Apr 17, 25",Yellow Garri (Paint),Tubers,Lagos (Ikeja),5500,8,44000,4200,12,Yes,10000
"Apr 17, 25",Indomie Super Pack,Noodles,Abuja,20000,4,80000,16800,65,No,0
"Apr 17, 25",Local Rice (50kg),Grains,Enugu,120000,-1,0,105000,117,No,5000
2025-04-18,Peak Milk 400g,Dairy,Kano,5800,23,133400,4900,99,No,10000
"Apr 18, 25",Frozen Turkey (kg),Meat,Lagos (Lekki),11000,6,66000,8800,24,No,10000
18-04-2025,Local Rice (50kg),Grains,Abuja,120000,22,2640000,105000,85,No,5000
2025.04.18,Yellow Garri (Paint),Tubers,Lagos (Lekki),Promo Price: 5000,28,154000,4200,144,No,0
"Apr 19, 25",Frozen Turkey (kg),Meat,Port Harcourt,11000,10,110000,8800,102,No,10000
2025-04-19,Local Rice (50kg),Grains,Ibadan,120000,8,960000,105000,70,No,50000
2025-04-19,Local Rice (50kg),Grains,Lagos (Ikeja),120000,-2,0,105000,94,No,0
19/04/2025,Frozen Turkey (kg),Meat,Abuja,11000,27,297000,8800,33,Yes,0
20/04/2025,Yam Tuber (Large),Produce,Lagos (Lekki),12000,23,276000,8000,58,No,50000
20/04/2025,Semovita 10kg,Swallow,Kano,10500,6,63000,9200,49,No,10000
2025-04-20,Yam Tuber (Large),Produce,Kano,12000,22,264000,8000,23,No,50000
20-04-2025,Yellow Garri (Paint),Tubers,Abuja,5500,5,27500,4200,59,No,50000
"Apr 21, 25",Milo Refill 500g,Beverages,Lagos (Lekki),7200,12,86400,6000,122,Yes,0
21/04/2025,Milo Refill 500g,Beverages,Ibadan,7200,27,194400,6000,38,No,0
2025-04-21,Milo Refill 500g,Beverages,Port Harcourt,7200,8,57600,6000,27,Yes,0
2025-04-21,Dangote Sugar 1kg,Sweeteners,Port Harcourt,4000,1,4000,3200,110,No,5000
2025.04.22,Dangote Sugar 1kg,Sweeteners,Lagos (Lekki),4000,13,52000,3200,104,No,0
2025.04.22,Frozen Turkey (kg),Meat,Lagos (Lekki),11000,5,55000,8800,170,Yes,5000
2025-04-22,Indomie Super Pack,Noodles,Kano,20000,0,0,16800,175,No,5000
22-04-2025,Peak Milk 400g,Dairy,Lagos (Ikeja),5800,-1,0,4900,138,Yes,0
2025.04.23,Local Rice (50kg),Grains,Abuja,120000,9,1080000,105000,153,Yes,10000
23-04-2025,Power Oil (Sachet),Oils,Ibadan,Promo Price: 0,9,4500,400,60,No,50000
23-04-2025,Beans Brown (Oloyin),Grains,Enugu,4500,20,90000,3200,53,No,50000
2025.04.23,Kings Oil 5L,Oils,Ibadan,27000,5,135000,21500,24,No,50000
24/04/2025,Yam Tuber (Large),Produce,Port Harcourt,12000,28,336000,8000,22,Yes,10000
"Apr 24, 25",Dangote Sugar 1kg,Sweeteners,Enugu,4000,24,96000,3200,29,No,0
2025-04-24,Frozen Turkey (kg),Meat,Abuja,11000,-1,0,8800,87,No,0
"Apr 24, 25",Frozen Turkey (kg),Meat,Kano,11000,28,308000,8800,115,Yes,10000
2025-04-25,Yellow Garri (Paint),Tubers,Abuja,5500,15,82500,4200,180,No,5000
25-04-2025,Dangote Sugar 1kg,Sweeteners,Abuja,4000,20,80000,3200,187,Yes,0
25/04/2025,Frozen Turkey (kg),Meat,Kano,Promo Price: 10500,19,209000,8800,87,No,10000
2025.04.25,Dangote Sugar 1kg,Sweeteners,Lagos (Lekki),Promo Price: 3500,-2,0,3200,99,No,5000
2025.04.26,Beans Brown (Oloyin),Grains,Lagos (Lekki),4500,16,72000,3200,45,No,50000
2025-04-26,Local Rice (50kg),Grains,Abuja,120000,14,1680000,105000,103,No,0
"Apr 26, 25",Frozen Turkey (kg),Meat,Enugu,11000,7,77000,8800,159,No,50000
"Apr 26, 25",Frozen Turkey (kg),Meat,Enugu,11000,8,88000,8800,183,No,0
2025.04.27,Milo Refill 500g,Beverages,Port Harcourt,7200,9,64800,6000,85,No,5000
2025.04.27,Yellow Garri (Paint),Tubers,Enugu,5500,14,77000,4200,133,No,0
2025-04-27,Milo Refill 500g,Beverages,Ibadan,7200,7,50400,6000,185,Yes,0
27-04-2025,Semovita 10kg,Swallow,Ibadan,10500,24,252000,9200,109,Yes,5000
"Apr 28, 25",Yellow Garri (Paint),Tubers,Lagos (Ikeja),5500,12,66000,4200,34,No,10000
28-04-2025,Indomie Super Pack,Noodles,Ibadan,20000,-1,0,16800,122,No,10000
"Apr 28, 25",Dangote Sugar 1kg,Sweeteners,Kano,4000,26,104000,3200,180,No,0
28/04/2025,Yellow Garri (Paint),Tubers,Port Harcourt,5500,7,38500,4200,102,No,0
29-04-2025,Local Rice (50kg),Grains,Abuja,120000,11,1320000,105000,94,Yes,0
29/04/2025,Frozen Turkey (kg),Meat,Port Harcourt,Promo Price: 10500,26,286000,8800,50,Yes,5000
29-04-2025,Indomie Super Pack,Noodles,Lagos (Ikeja),20000,25,500000,16800,95,Yes,0
2025-04-29,Semovita 10kg,Swallow,Enugu,NGN 10500,10,105000,9200,88,No,10000
2025-04-30,Local Rice (50kg),Grains,Kano,120000,16,1920000,105000,15,Yes,50000
"Apr 30, 25",Beans Brown (Oloyin),Grains,Lagos (Lekki),4500,3,13500,3200,29,Yes,0
30/04/2025,Kings Oil 5L,Oils,Lagos (Lekki),27000,6,162000,21500,87,No,0
"Apr 30, 25",Local Rice (50kg),Grains,Enugu,120000,-1,0,105000,139,Yes,0
01-05-2025,Local Rice (50kg),Grains,Ibadan,120000,0,0,105000,58,No,5000
"May 01, 25",Kings Oil 5L,Oils,Kano,27000,9,243000,21500,104,No,0
01-05-2025,Indomie Super Pack,Noodles,Kano,20000,9,180000,16800,200,No,0
2025-05-01,Milo Refill 500g,Beverages,Kano,7200,8,57600,6000,99,No,10000
2025-05-02,Dangote Sugar 1kg,Sweeteners,Abuja,Promo Price: 3500,6,24000,3200,28,No,50000
"May 02, 25",Kings Oil 5L,Oils,Kano,27000,30,810000,21500,75,No,5000
"May 02, 25",Frozen Turkey (kg),Meat,Ibadan,11000,12,132000,8800,115,Yes,0
"May 02, 25",Yellow Garri (Paint),Tubers,Kano,5500,24,132000,4200,65,Yes,50000
"May 03, 25",Frozen Turkey (kg),Meat,Lagos (Ikeja),11000,13,143000,8800,95,No,5000
"May 03, 25",Frozen Turkey (kg),Meat,Abuja,11000,23,253000,8800,71,Yes,0
2025.05.03,Peak Milk 400g,Dairy,Ibadan,5800,2,11600,4900,99,Yes,0
"May 03, 25",Local Rice (50kg),Grains,Enugu,Promo Price: 119500,20,2400000,105000,62,No,50000
2025-05-04,Frozen Turkey (kg),Meat,Kano,11000,22,242000,8800,116,No,10000
2025.05.04,Frozen Turkey (kg),Meat,Abuja,11000,12,132000,8800,183,No,5000
04-05-2025,Dangote Sugar 1kg,Sweeteners,Enugu,4000,9,36000,3200,145,Yes,5000
2025.05.04,Indomie Super Pack,Noodles,Enugu,20000,26,520000,16800,118,No,0
2025-05-05,Peak Milk 400g,Dairy,Lagos (Lekki),5800,0,0,4900,146,No,0
"May 05, 25",Dangote Sugar 1kg,Sweeteners,Abuja,4000,28,112000,3200,13,Yes,5000
05-05-2025,Milo Refill 500g,Beverages,Kano,7200,10,72000,6000,43,No,5000
2025-05-05,Local Rice (50kg),Grains,Lagos (Lekki),120000,7,840000,105000,190,No,5000
2025.05.06,Peak Milk 400g,Dairy,Lagos (Ikeja),5800,-1,0,4900,68,No,0
Last Friday,Semovita 10kg,Swallow,Abuja,10500,8,84000,9200,136,No,50000
06/05/2025,Power Oil (Sachet),Oils,Lagos (Ikeja),500,10,5000,400,136,No,0
06/05/2025,Kings Oil 5L,Oils,Lagos (Ikeja),NGN 27000,-2,0,21500,67,No,10000
"May 07, 25",Indomie Super Pack,Noodles,Kano,20000,25,500000,16800,70,No,5000
07/05/2025,Kings Oil 5L,Oils,Ibadan,27000,2,54000,21500,194,No,0
"May 07, 25",Milo Refill 500g,Beverages,Abuja,7200,6,43200,6000,35,Yes,0
2025.05.07,Semovita 10kg,Swallow,Lagos (Lekki),10500,11,115500,9200,112,No,50000
08-05-2025,Milo Refill 500g,Beverages,Ibadan,7200,-2,0,6000,36,Yes,5000
08-05-2025,Power Oil (Sachet),Oils,Lagos (Lekki),500,18,9000,400,86,No,0
08/05/2025,Peak Milk 400g,Dairy,Lagos (Ikeja),5800,3,17400,4900,50,No,10000
08-05-2025,Local Rice (50kg),Grains,Kano,120000,1,120000,105000,121,No,0
09-05-2025,Peak Milk 400g,Dairy,Lagos (Ikeja),5800,11,63800,4900,49,No,50000
2025.05.09,Yam Tuber (Large),Produce,Lagos (Lekki),12000,15,180000,8000,145,No,0
2025-05-09,Kings Oil 5L,Oils,Lagos (Lekki),27000,10,270000,21500,150,No,50000
09/05/2025,Frozen Turkey (kg),Meat,Enugu,11000,15,165000,8800,124,No,10000
"May 10, 25",Power Oil (Sachet),Oils,Lagos (Ikeja),500,6,3000,400,56,No,0
10/05/2025,Indomie Super Pack,Noodles,Port Harcourt,20000,28,560000,16800,44,Yes,0
10/05/2025,Semovita 10kg,Swallow,Ibadan,10500,21,220500,9200,69,No,5000
10-05-2025,Kings Oil 5L,Oils,Port Harcourt,27000,23,621000,21500,51,Yes,0
11/05/2025,Yam Tuber (Large),Produce,Lagos (Lekki),12000,23,276000,8000,192,No,5000
2025.05.11,Indomie Super Pack,Noodles,Enugu,20000,26,520000,16800,187,No,10000
2025.05.11,Yam Tuber (Large),Produce,Ibadan,12000,30,360000,8000,104,No,50000
11-05-2025,Yam Tuber (Large),Produce,Lagos (Lekki),12000,7,84000,8000,56,No,10000
2025-05-12,Semovita 10kg,Swallow,Lagos (Ikeja),Promo Price: 10000,19,199500,9200,93,Yes,0
2025.05.12,Dangote Sugar 1kg,Sweeteners,Lagos (Ikeja),4000,0,0,3200,19,No,5000
"May 12, 25",Indomie Super Pack,Noodles,Lagos (Ikeja),20000,12,240000,16800,56,No,5000
12/05/2025,Frozen Turkey (kg),Meat,Port Harcourt,11000,3,33000,8800,88,No,50000
13-05-2025,Peak Milk 400g,Dairy,Ibadan,5800,3,17400,4900,167,No,10000
13/05/2025,Beans Brown (Oloyin),Grains,Lagos (Lekki),4500,17,76500,3200,36,Yes,0
2025-05-13,Peak Milk 400g,Dairy,Port Harcourt,5800,17,98600,4900,76,No,0
2025.05.13,Peak Milk 400g,Dairy,Port Harcourt,5800,24,139200,4900,112,No,0
14-05-2025,Kings Oil 5L,Oils,Abuja,27000,16,432000,21500,70,No,0
2025.05.14,Yellow Garri (Paint),Tubers,Enugu,5500,12,66000,4200,121,No,0
2025-05-14,Peak Milk 400g,Dairy,Lagos (Ikeja),NGN 5800,0,0,4900,171,No,0
2025-05-14,Kings Oil 5L,Oils,Port Harcourt,27000,27,729000,21500,37,No,0
2025-05-15,Dangote Sugar 1kg,Sweeteners,Port Harcourt,4000,24,96000,3200,162,No,10000
"May 15, 25",Beans Brown (Oloyin),Grains,Port Harcourt,4500,8,36000,3200,21,No,50000
2025-05-15,Beans Brown (Oloyin),Grains,Enugu,4500,13,58500,3200,26,No,10000
2025-05-15,Indomie Super Pack,Noodles,Lagos (Ikeja),20000,1,20000,16800,105,No,0
16-05-2025,Frozen Turkey (kg),Meat,Lagos (Ikeja),11000,26,286000,8800,141,No,10000
16-05-2025,Peak Milk 400g,Dairy,Lagos (Lekki),5800,2,11600,4900,141,No,0
16-05-2025,Peak Milk 400g,Dairy,Lagos (Ikeja),5800,28,162400,4900,189,Yes,10000
2025.05.16,Peak Milk 400g,Dairy,Abuja,5800,21,121800,4900,155,No,5000
17-05-2025,Kings Oil 5L,Oils,Enugu,27000,4,108000,21500,187,No,0
2025-05-17,Local Rice (50kg),Grains,Lagos (Lekki),120000,4,480000,105000,59,No,0
17-05-2025,Semovita 10kg,Swallow,Abuja,10500,11,115500,9200,95,Yes,10000
17-05-2025,Semovita 10kg,Swallow,Abuja,Promo Price: 10000,12,126000,9200,168,No,50000
18/05/2025,Peak Milk 400g,Dairy,Lagos (Lekki),5800,7,40600,4900,28,No,5000
18/05/2025,Yam Tuber (Large),Produce,Lagos (Lekki),12000,0,0,8000,66,No,0
2025.05.18,Yellow Garri (Paint),Tubers,Lagos (Ikeja),5500,0,0,4200,37,No,0
2025-05-18,Power Oil (Sachet),Oils,Abuja,NGN 500,-1,0,400,200,Yes,5000
2025-05-19,Peak Milk 400g,Dairy,Lagos (Lekki),5800,-1,0,4900,14,No,5000
"May 19, 25",Kings Oil 5L,Oils,Lagos (Ikeja),27000,23,621000,21500,188,No,0
19-05-2025,Local Rice (50kg),Grains,Lagos (Ikeja),120000,20,2400000,105000,42,No,10000
2025-05-19,Peak Milk 400g,Dairy,Abuja,5800,8,46400,4900,13,No,10000
20/05/2025,Yellow Garri (Paint),Tubers,Lagos (Lekki),Promo Price: 5000,8,44000,4200,58,No,0
20/05/2025,Frozen Turkey (kg),Meat,Lagos (Ikeja),11000,5,55000,8800,17,No,0
"May 20, 25",Yam Tuber (Large),Produce,Port Harcourt,12000,0,0,8000,171,No,10000
2025.05.20,Yam Tuber (Large),Produce,Lagos (Ikeja),12000,5,60000,8000,47,No,0
"May 21, 25",Power Oil (Sachet),Oils,Abuja,Promo Price: 0,11,5500,400,138,No,0
"May 21, 25",Semovita 10kg,Swallow,Lagos (Ikeja),10500,25,262500,9200,20,No,50000
21-05-2025,Semovita 10kg,Swallow,Enugu,10500,18,189000,9200,146,No,0
21-05-2025,Power Oil (Sachet),Oils,Kano,500,-2,0,400,108,Yes,0
22-05-2025,Peak Milk 400g,Dairy,Lagos (Ikeja),5800,19,110200,4900,33,No,10000
2025.05.22,Milo Refill 500g,Beverages,Kano,7200,4,28800,6000,92,No,0
22/05/2025,Peak Milk 400g,Dairy,Lagos (Ikeja),5800,18,104400,4900,135,No,5000
22-05-2025,Beans Brown (Oloyin),Grains,Lagos (Lekki),4500,27,121500,3200,156,No,0
23-05-2025,Dangote Sugar 1kg,Sweeteners,Port Harcourt,4000,24,96000,3200,37,No,5000
23-05-2025,Milo Refill 500g,Beverages,Abuja,7200,-1,0,6000,38,Yes,50000
2025.05.23,Dangote Sugar 1kg,Sweeteners,Enugu,4000,1,4000,3200,99,No,5000
"May 23, 25",Yellow Garri (Paint),Tubers,Enugu,5500,27,148500,4200,85,No,10000
2025-05-24,Power Oil (Sachet),Oils,Abuja,500,21,10500,400,155,No,10000
2025-05-24,Semovita 10kg,Swallow,Lagos (Ikeja),10500,28,294000,9200,26,Yes,0
"May 24, 25",Power Oil (Sachet),Oils,Port Harcourt,500,12,6000,400,151,No,0
24/05/2025,Yam Tuber (Large),Produce,Enugu,12000,26,312000,8000,153,Yes,50000
"May 25, 25",Milo Refill 500g,Beverages,Enugu,7200,23,165600,6000,141,No,10000
25-05-2025,Indomie Super Pack,Noodles,Enugu,Promo Price: 19500,17,340000,16800,171,No,10000
2025-05-25,Dangote Sugar 1kg,Sweeteners,Ibadan,4000,22,88000,3200,133,No,50000
25-05-2025,Yellow Garri (Paint),Tubers,Port Harcourt,NGN 5500,17,93500,4200,190,No,5000
2025.05.26,Yellow Garri (Paint),Tubers,Enugu,5500,29,159500,4200,63,No,0
26/05/2025,Yellow Garri (Paint),Tubers,Enugu,5500,0,0,4200,80,No,10000
2025.05.26,Milo Refill 500g,Beverages,Enugu,7200,30,216000,6000,155,No,5000
2025-05-26,Beans Brown (Oloyin),Grains,Enugu,4500,22,99000,3200,30,No,0
27-05-2025,Beans Brown (Oloyin),Grains,Ibadan,4500,23,103500,3200,103,No,0
2025-05-27,Milo Refill 500g,Beverages,Abuja,7200,6,43200,6000,166,No,50000
"May 27, 25",Power Oil (Sachet),Oils,Port Harcourt,NGN 500,17,8500,400,187,No,50000
27-05-2025,Frozen Turkey (kg),Meat,Kano,11000,10,110000,8800,138,No,10000
"May 28, 25",Milo Refill 500g,Beverages,Enugu,7200,13,93600,6000,48,No,5000
2025.05.28,Kings Oil 5L,Oils,Lagos (Lekki),27000,18,486000,21500,175,Yes,50000
28-05-2025,Yam Tuber (Large),Produce,Kano,12000,23,276000,8000,78,No,0
28/05/2025,Yellow Garri (Paint),Tubers,Enugu,5500,1,5500,4200,182,No,0
2025.05.29,Semovita 10kg,Swallow,Ibadan,10500,15,157500,9200,146,Yes,0
29/05/2025,Semovita 10kg,Swallow,Abuja,10500,9,94500,9200,62,Yes,50000
2025.05.29,Yam Tuber (Large),Produce,Lagos (Ikeja),12000,-2,0,8000,160,No,5000
29/05/2025,Frozen Turkey (kg),Meat,Kano,Promo Price: 10500,1,11000,8800,111,No,10000
30-05-2025,Beans Brown (Oloyin),Grains,Ibadan,4500,16,72000,3200,45,No,50000
30/05/2025,Yam Tuber (Large),Produce,Port Harcourt,12000,22,264000,8000,58,No,10000
2025-05-30,Power Oil (Sachet),Oils,Ibadan,500,10,5000,400,32,No,50000
2025.05.30,Milo Refill 500g,Beverages,Ibadan,7200,23,165600,6000,125,No,50000
31-05-2025,Semovita 10kg,Swallow,Kano,10500,9,94500,9200,164,No,10000
"May 31, 25",Yam Tuber (Large),Produce,Enugu,12000,18,216000,8000,55,No,10000
31-05-2025,Semovita 10kg,Swallow,Lagos (Ikeja),10500,11,115500,9200,46,No,10000
2025.05.31,Power Oil (Sachet),Oils,Enugu,500,23,11500,400,189,No,50000
01-06-2025,Local Rice (50kg),Grains,Lagos (Ikeja),120000,10,1200000,105000,152,Yes,0
01/06/2025,Peak Milk 400g,Dairy,Ibadan,5800,6,34800,4900,173,Yes,0
2025-06-01,Power Oil (Sachet),Oils,Abuja,500,10,5000,400,162,No,0
2025-06-01,Kings Oil 5L,Oils,Kano,27000,-2,0,21500,73,Yes,50000
02-06-2025,Power Oil (Sachet),Oils,Lagos (Ikeja),500,11,5500,400,192,No,50000
02/06/2025,Power Oil (Sachet),Oils,Ibadan,500,30,15000,400,109,No,5000
2025.06.02,Milo Refill 500g,Beverages,Abuja,7200,8,57600,6000,145,Yes,50000
02-06-2025,Frozen Turkey (kg),Meat,Ibadan,11000,12,132000,8800,189,No,5000
03/06/2025,Power Oil (Sachet),Oils,Port Harcourt,500,8,4000,400,149,No,50000
2025.06.03,Indomie Super Pack,Noodles,Kano,20000,5,100000,16800,169,Yes,0
03-06-2025,Yellow Garri (Paint),Tubers,Lagos (Lekki),5500,2,11000,4200,144,No,10000
03-06-2025,Yellow Garri (Paint),Tubers,Enugu,5500,-2,0,4200,69,No,0
2025-06-04,Milo Refill 500g,Beverages,Kano,7200,9,64800,6000,186,No,50000
2025.06.04,Yam Tuber (Large),Produce,Port Harcourt,12000,20,240000,8000,166,No,5000
"Jun 04, 25",Peak Milk 400g,Dairy,Port Harcourt,5800,8,46400,4900,150,No,10000
04/06/2025,Yellow Garri (Paint),Tubers,Enugu,5500,7,38500,4200,27,No,50000
2025.06.05,Peak Milk 400g,Dairy,Lagos (Lekki),5800,13,75400,4900,25,No,10000
2025.06.05,Yellow Garri (Paint),Tubers,Ibadan,Promo Price: 5000,9,49500,4200,118,No,0
05/06/2025,Yam Tuber (Large),Produce,Enugu,12000,23,276000,8000,103,No,0
"Jun 05, 25",Power Oil (Sachet),Oils,Ibadan,500,9,4500,400,99,No,0
2025-06-06,Yellow Garri (Paint),Tubers,Lagos (Lekki),5500,8,44000,4200,32,No,0
2025.06.06,Dangote Sugar 1kg,Sweeteners,Enugu,4000,18,72000,3200,63,No,10000
"Jun 06, 25",Indomie Super Pack,Noodles,Abuja,20000,-1,0,16800,157,Yes,0
2025-06-06,Yam Tuber (Large),Produce,Enugu,12000,0,0,8000,200,No,5000
"Jun 07, 25",Yam Tuber (Large),Produce,Kano,12000,10,120000,8000,46,No,50000
07-06-2025,Peak Milk 400g,Dairy,Enugu,5800,10,58000,4900,100,Yes,0
07/06/2025,Milo Refill 500g,Beverages,Ibadan,7200,29,208800,6000,148,No,50000
2025.06.07,Beans Brown (Oloyin),Grains,Port Harcourt,4500,25,112500,3200,129,No,50000
08/06/2025,Milo Refill 500g,Beverages,Lagos (Ikeja),7200,5,36000,6000,63,Yes,10000
08/06/2025,Frozen Turkey (kg),Meat,Lagos (Lekki),11000,-1,0,8800,103,No,0
"Jun 08, 25",Frozen Turkey (kg),Meat,Lagos (Ikeja),11000,17,187000,8800,126,No,0
08-06-2025,Semovita 10kg,Swallow,Ibadan,10500,8,84000,9200,175,Yes,10000
09-06-2025,Peak Milk 400g,Dairy,Port Harcourt,5800,2,11600,4900,108,No,50000
2025-06-09,Milo Refill 500g,Beverages,Abuja,7200,5,36000,6000,29,No,5000
2025.06.09,Peak Milk 400g,Dairy,Abuja,5800,9,52200,4900,164,No,0
2025.06.09,Semovita 10kg,Swallow,Port Harcourt,10500,12,126000,9200,30,No,10000
2025.06.10,Semovita 10kg,Swallow,Kano,10500,25,262500,9200,34,No,50000
"Jun 10, 25",Milo Refill 500g,Beverages,Abuja,7200,26,187200,6000,65,No,0
2025.06.10,Frozen Turkey (kg),Meat,Port Harcourt,11000,19,209000,8800,163,Yes,10000
10-06-2025,Yellow Garri (Paint),Tubers,Ibadan,5500,14,77000,4200,184,No,0
2025.06.11,Local Rice (50kg),Grains,Kano,NGN 120000,22,2640000,105000,31,No,0
11/06/2025,Yellow Garri (Paint),Tubers,Abuja,5500,-1,0,4200,161,No,50000
2025-06-11,Indomie Super Pack,Noodles,Abuja,20000,6,120000,16800,92,No,10000
11/06/2025,Semovita 10kg,Swallow,Ibadan,10500,16,168000,9200,52,No,10000
"Jun 12, 25",Yam Tuber (Large),Produce,Lagos (Ikeja),12000,15,180000,8000,189,Yes,10000
12/06/2025,Frozen Turkey (kg),Meat,Kano,11000,19,209000,8800,191,Yes,10000
12-06-2025,Yam Tuber (Large),Produce,Port Harcourt,NGN 12000,18,216000,8000,107,No,5000
2025-06-12,Dangote Sugar 1kg,Sweeteners,Port Harcourt,4000,24,96000,3200,98,Yes,0
"Jun 13, 25",Frozen Turkey (kg),Meat,Enugu,NGN 11000,4,44000,8800,161,No,10000
13/06/2025,Local Rice (50kg),Grains,Enugu,120000,1,120000,105000,90,No,10000
2025-06-13,Kings Oil 5L,Oils,Lagos (Lekki),27000,28,756000,21500,46,No,10000
13/06/2025,Semovita 10kg,Swallow,Port Harcourt,Promo Price: 10000,25,262500,9200,21,No,5000
"Jun 14, 25",Yellow Garri (Paint),Tubers,Port Harcourt,5500,3,16500,4200,91,No,0
2025.06.14,Kings Oil 5L,Oils,Lagos (Ikeja),27000,27,729000,21500,59,No,5000
2025.06.14,Dangote Sugar 1kg,Sweeteners,Port Harcourt,4000,6,24000,3200,10,Yes,0
"Jun 14, 25",Power Oil (Sachet),Oils,Kano,500,12,6000,400,160,Yes,10000
2025.06.15,Yam Tuber (Large),Produce,Ibadan,NGN 12000,6,72000,8000,101,Yes,0
2025-06-15,Local Rice (50kg),Grains,Lagos (Ikeja),120000,18,2160000,105000,20,No,0
2025.06.15,Kings Oil 5L,Oils,Kano,27000,16,432000,21500,47,No,0
15/06/2025,Frozen Turkey (kg),Meat,Lagos (Lekki),Promo Price: 10500,10,110000,8800,164,No,5000
"Jun 16, 25",Local Rice (50kg),Grains,Enugu,Promo Price: 119500,-2,0,105000,63,No,0
16/06/2025,Semovita 10kg,Swallow,Lagos (Ikeja),10500,13,136500,9200,170,Yes,0
16/06/2025,Dangote Sugar 1kg,Sweeteners,Ibadan,4000,14,56000,3200,13,No,5000
16-06-2025,Milo Refill 500g,Beverages,Lagos (Lekki),7200,18,129600,6000,181,Yes,10000
17/06/2025,Kings Oil 5L,Oils,Abuja,27000,18,486000,21500,84,No,10000
17/06/2025,Milo Refill 500g,Beverages,Lagos (Lekki),7200,30,216000,6000,136,Yes,50000
2025-06-17,Peak Milk 400g,Dairy,Port Harcourt,Promo Price: 5300,12,69600,4900,177,Yes,5000
17/06/2025,Indomie Super Pack,Noodles,Port Harcourt,20000,14,280000,16800,149,No,5000
2025-06-18,Indomie Super Pack,Noodles,Lagos (Ikeja),NGN 20000,13,260000,16800,161,No,50000
2025.06.18,Indomie Super Pack,Noodles,Port Harcourt,20000,14,280000,16800,132,Yes,10000
2025.06.18,Local Rice (50kg),Grains,Lagos (Ikeja),Promo Price: 119500,19,2280000,105000,164,No,0
"Jun 18, 25",Local Rice (50kg),Grains,Ibadan,120000,21,2520000,105000,62,No,0
2025-06-19,Yellow Garri (Paint),Tubers,Ibadan,5500,17,93500,4200,81,No,50000
19/06/2025,Peak Milk 400g,Dairy,Lagos (Lekki),5800,28,162400,4900,89,No,5000
19/06/2025,Yellow Garri (Paint),Tubers,Lagos (Ikeja),5500,22,121000,4200,128,No,10000
2025-06-19,Milo Refill 500g,Beverages,Enugu,7200,9,64800,6000,160,No,5000
20/06/2025,Kings Oil 5L,Oils,Kano,27000,5,135000,21500,161,No,50000
20/06/2025,Peak Milk 400g,Dairy,Abuja,5800,9,52200,4900,97,No,50000
20/06/2025,Kings Oil 5L,Oils,Lagos (Lekki),27000,20,540000,21500,112,Yes,0
"Jun 20, 25",Dangote Sugar 1kg,Sweeteners,Lagos (Ikeja),4000,17,68000,3200,179,No,50000
2025-06-21,Yam Tuber (Large),Produce,Lagos (Lekki),12000,16,192000,8000,58,No,0
2025.06.21,Indomie Super Pack,Noodles,Enugu,20000,28,560000,16800,151,No,50000
"Jun 21, 25",Indomie Super Pack,Noodles,Enugu,20000,4,80000,16800,79,No,50000
21-06-2025,Beans Brown (Oloyin),Grains,Ibadan,Promo Price: 4000,5,22500,3200,145,Yes,50000
2025-06-22,Yellow Garri (Paint),Tubers,Lagos (Lekki),5500,18,99000,4200,175,No,0
2025-06-22,Yellow Garri (Paint),Tubers,Port Harcourt,5500,11,60500,4200,23,No,50000
22-06-2025,Peak Milk 400g,Dairy,Port Harcourt,5800,9,52200,4900,88,No,50000
22-06-2025,Indomie Super Pack,Noodles,Kano,20000,5,100000,16800,158,Yes,5000
"Jun 23, 25",Yam Tuber (Large),Produce,Lagos (Ikeja),Promo Price: 11500,23,276000,8000,158,Yes,50000
23-06-2025,Power Oil (Sachet),Oils,Lagos (Ikeja),500,14,7000,400,55,Yes,0
2025-06-23,Local Rice (50kg),Grains,Ibadan,120000,21,2520000,105000,118,No,50000
2025-06-23,Kings Oil 5L,Oils,Kano,27000,29,783000,21500,171,No,10000
24/06/2025,Frozen Turkey (kg),Meat,Lagos (Lekki),NGN 11000,12,132000,8800,200,No,5000
2025.06.24,Local Rice (50kg),Grains,Lagos (Lekki),120000,3,360000,105000,140,Yes,5000
24/06/2025,Beans Brown (Oloyin),Grains,Enugu,4500,-2,0,3200,49,No,0
"Jun 24, 25",Yellow Garri (Paint),Tubers,Ibadan,5500,10,55000,4200,18,No,0
25-06-2025,Indomie Super Pack,Noodles,Port Harcourt,20000,0,0,16800,44,No,0
2025-06-25,Yam Tuber (Large),Produce,Ibadan,12000,30,360000,8000,187,Yes,50000
2025-06-25,Peak Milk 400g,Dairy,Ibadan,5800,18,104400,4900,71,No,5000
2025.06.25,Yam Tuber (Large),Produce,Ibadan,12000,9,108000,8000,141,No,0
2025-06-26,Milo Refill 500g,Beverages,Ibadan,7200,12,86400,6000,25,Yes,50000
"Jun 26, 25",Beans Brown (Oloyin),Grains,Enugu,4500,30,135000,3200,181,Yes,5000
"Jun 26, 25",Frozen Turkey (kg),Meat,Enugu,11000,18,198000,8800,36,Yes,0
26-06-2025,Frozen Turkey (kg),Meat,Enugu,11000,27,297000,8800,151,No,10000
27-06-2025,Indomie Super Pack,Noodles,Lagos (Ikeja),20000,13,260000,16800,170,Yes,5000
2025.06.27,Yellow Garri (Paint),Tubers,Abuja,5500,6,33000,4200,21,No,0
2025-06-27,Yellow Garri (Paint),Tubers,Lagos (Ikeja),5500,9,49500,4200,63,No,10000
27/06/2025,Yam Tuber (Large),Produce,Abuja,12000,16,192000,8000,129,No,0
2025-06-28,Beans Brown (Oloyin),Grains,Enugu,4500,0,0,3200,59,No,0
28/06/2025,Yellow Garri (Paint),Tubers,Ibadan,5500,17,93500,4200,142,No,0
2025.06.28,Yellow Garri (Paint),Tubers,Port Harcourt,5500,9,49500,4200,43,Yes,10000
2025-06-28,Milo Refill 500g,Beverages,Enugu,7200,28,201600,6000,66,No,5000
2025.06.29,Power Oil (Sachet),Oils,Lagos (Ikeja),500,18,9000,400,147,Yes,0
29/06/2025,Local Rice (50kg),Grains,Abuja,120000,12,1440000,105000,177,No,0
2025-06-29,Yellow Garri (Paint),Tubers,Lagos (Ikeja),5500,11,60500,4200,42,No,0
"Jun 29, 25",Beans Brown (Oloyin),Grains,Lagos (Ikeja),4500,9,40500,3200,47,No,0
2025-06-30,Milo Refill 500g,Beverages,Lagos (Ikeja),7200,14,100800,6000,121,No,10000
"Jun 30, 25",Milo Refill 500g,Beverages,Port Harcourt,7200,28,201600,6000,92,Yes,5000
30-06-2025,Milo Refill 500g,Beverages,Port Harcourt,7200,1,7200,6000,32,No,50000
2025-06-30,Power Oil (Sachet),Oils,Port Harcourt,500,4,2000,400,27,Yes,0
01-07-2025,Yam Tuber (Large),Produce,Lagos (Ikeja),12000,2,24000,8000,104,No,5000
"Jul 01, 25",Yam Tuber (Large),Produce,Lagos (Lekki),12000,25,300000,8000,107,No,50000
2025.07.01,Indomie Super Pack,Noodles,Lagos (Lekki),20000,16,320000,16800,139,No,10000
2025-07-01,Milo Refill 500g,Beverages,Enugu,7200,6,43200,6000,23,No,10000
02/07/2025,Milo Refill 500g,Beverages,Lagos (Ikeja),7200,30,216000,6000,172,No,0
02/07/2025,Milo Refill 500g,Beverages,Enugu,7200,3,21600,6000,75,Yes,0
2025-07-02,Peak Milk 400g,Dairy,Enugu,5800,11,63800,4900,150,No,50000
2025.07.02,Power Oil (Sachet),Oils,Lagos (Lekki),500,27,13500,400,106,No,5000
03-07-2025,Peak Milk 400g,Dairy,Ibadan,5800,2,11600,4900,183,No,0
2025.07.03,Dangote Sugar 1kg,Sweeteners,Ibadan,4000,8,32000,3200,151,No,0
03/07/2025,Indomie Super Pack,Noodles,Lagos (Lekki),20000,10,200000,16800,186,No,50000
2025-07-03,Frozen Turkey (kg),Meat,Abuja,11000,11,121000,8800,124,No,0
2025-07-04,Beans Brown (Oloyin),Grains,Lagos (Ikeja),Promo Price: 4000,29,130500,3200,89,No,10000
04/07/2025,Indomie Super Pack,Noodles,Lagos (Lekki),NGN 20000,17,340000,16800,196,No,0
04/07/2025,Yam Tuber (Large),Produce,Kano,12000,25,300000,8000,197,No,10000
"Jul 04, 25",Indomie Super Pack,Noodles,Port Harcourt,20000,2,40000,16800,109,No,50000
05-07-2025,Semovita 10kg,Swallow,Lagos (Lekki),10500,5,52500,9200,111,No,0
"Jul 05, 25",Power Oil (Sachet),Oils,Ibadan,500,25,12500,400,185,No,0
05-07-2025,Indomie Super Pack,Noodles,Ibadan,20000,8,160000,16800,199,No,50000
05-07-2025,Local Rice (50kg),Grains,Lagos (Ikeja),NGN 120000,23,2760000,105000,173,No,10000
2025-07-06,Power Oil (Sachet),Oils,Lagos (Lekki),500,10,5000,400,194,No,0
2025-07-06,Yam Tuber (Large),Produce,Abuja,12000,23,276000,8000,37,No,5000
2025-07-06,Dangote Sugar 1kg,Sweeteners,Enugu,4000,15,60000,3200,163,No,10000
06-07-2025,Dangote Sugar 1kg,Sweeteners,Port Harcourt,4000,20,80000,3200,79,Yes,5000
"Jul 07, 25",Yellow Garri (Paint),Tubers,Ibadan,5500,4,22000,4200,57,No,10000
07-07-2025,Indomie Super Pack,Noodles,Abuja,20000,19,380000,16800,79,Yes,5000
07-07-2025,Milo Refill 500g,Beverages,Kano,7200,3,21600,6000,132,No,50000
"Jul 07, 25",Frozen Turkey (kg),Meat,Enugu,11000,21,231000,8800,23,Yes,10000
"Jul 08, 25",Dangote Sugar 1kg,Sweeteners,Abuja,4000,26,104000,3200,82,No,10000
2025.07.08,Semovita 10kg,Swallow,Lagos (Ikeja),NGN 10500,18,189000,9200,63,No,0
08/07/2025,Dangote Sugar 1kg,Sweeteners,Port Harcourt,4000,11,44000,3200,117,Yes,5000
08/07/2025,Local Rice (50kg),Grains,Ibadan,120000,21,2520000,105000,91,No,0
09-07-2025,Peak Milk 400g,Dairy,Kano,5800,27,156600,4900,39,No,10000
09-07-2025,Frozen Turkey (kg),Meat,Kano,NGN 11000,20,220000,8800,151,No,0
2025.07.09,Yellow Garri (Paint),Tubers,Abuja,NGN 5500,29,159500,4200,58,No,10000
2025.07.09,Yellow Garri (Paint),Tubers,Port Harcourt,5500,16,88000,4200,109,No,0
10-07-2025,Local Rice (50kg),Grains,Ibadan,120000,30,3600000,105000,54,No,0
2025-07-10,Frozen Turkey (kg),Meat,Ibadan,11000,26,286000,8800,31,Yes,0
"Jul 10, 25",Dangote Sugar 1kg,Sweeteners,Ibadan,4000,6,24000,3200,173,No,0
2025-07-10,Peak Milk 400g,Dairy,Kano,5800,7,40600,4900,13,No,5000
2025-07-11,Beans Brown (Oloyin),Grains,Enugu,4500,-2,0,3200,133,Yes,0
11-07-2025,Kings Oil 5L,Oils,Abuja,27000,29,783000,21500,155,No,0
11/07/2025,Milo Refill 500g,Beverages,Lagos (Ikeja),7200,1,7200,6000,95,No,50000
"Jul 11, 25",Beans Brown (Oloyin),Grains,Enugu,NGN 4500,1,4500,3200,199,No,10000
"Jul 12, 25",Frozen Turkey (kg),Meat,Ibadan,11000,24,264000,8800,120,No,10000
12-07-2025,Indomie Super Pack,Noodles,Lagos (Ikeja),20000,23,460000,16800,14,No,50000
2025.07.12,Power Oil (Sachet),Oils,Lagos (Lekki),500,-2,0,400,168,No,5000
2025.07.12,Yellow Garri (Paint),Tubers,Lagos (Ikeja),Promo Price: 5000,8,44000,4200,109,Yes,50000
13-07-2025,Power Oil (Sachet),Oils,Port Harcourt,500,30,15000,400,61,No,0
"Jul 13, 25",Yellow Garri (Paint),Tubers,Enugu,Promo Price: 5000,10,55000,4200,119,No,10000
13/07/2025,Power Oil (Sachet),Oils,Lagos (Lekki),500,6,3000,400,99,No,10000
2025.07.13,Semovita 10kg,Swallow,Port Harcourt,10500,27,283500,9200,143,No,10000
14/07/2025,Dangote Sugar 1kg,Sweeteners,Ibadan,4000,-1,0,3200,133,No,5000
14-07-2025,Power Oil (Sachet),Oils,Lagos (Ikeja),500,27,13500,400,68,No,5000
14-07-2025,Peak Milk 400g,Dairy,Kano,5800,6,34800,4900,126,Yes,0
14-07-2025,Indomie Super Pack,Noodles,Ibadan,20000,5,100000,16800,169,No,50000
15/07/2025,Dangote Sugar 1kg,Sweeteners,Lagos (Ikeja),NGN 4000,27,108000,3200,79,No,50000
2025-07-15,Frozen Turkey (kg),Meat,Lagos (Lekki),11000,1,11000,8800,177,No,0
15/07/2025,Kings Oil 5L,Oils,Kano,27000,18,486000,21500,112,Yes,0
15-07-2025,Kings Oil 5L,Oils,Lagos (Lekki),27000,8,216000,21500,104,No,50000
2025-07-16,Kings Oil 5L,Oils,Enugu,27000,17,459000,21500,69,Yes,5000
"Jul 16, 25",Power Oil (Sachet),Oils,Enugu,500,21,10500,400,105,No,0
"Jul 16, 25",Peak Milk 400g,Dairy,Port Harcourt,5800,5,29000,4900,52,Yes,50000
2025-07-16,Semovita 10kg,Swallow,Lagos (Ikeja),10500,14,147000,9200,122,No,50000
2025.07.17,Power Oil (Sachet),Oils,Abuja,500,12,6000,400,52,Yes,0
17-07-2025,Frozen Turkey (kg),Meat,Port Harcourt,11000,20,220000,8800,108,No,0
17/07/2025,Dangote Sugar 1kg,Sweeteners,Ibadan,4000,-1,0,3200,198,No,5000
17-07-2025,Dangote Sugar 1kg,Sweeteners,Kano,4000,30,120000,3200,108,Yes,10000
2025-07-18,Frozen Turkey (kg),Meat,Enugu,11000,19,209000,8800,21,Yes,10000
18-07-2025,Yam Tuber (Large),Produce,Port Harcourt,12000,18,216000,8000,58,Yes,0
"Jul 18, 25",Power Oil (Sachet),Oils,Ibadan,500,28,14000,400,67,No,0
"Jul 18, 25",Kings Oil 5L,Oils,Abuja,27000,2,54000,21500,141,Yes,50000
2025-07-19,Yam Tuber (Large),Produce,Port Harcourt,12000,23,276000,8000,28,No,10000
19-07-2025,Yam Tuber (Large),Produce,Lagos (Ikeja),12000,8,96000,8000,151,No,10000
"Jul 19, 25",Frozen Turkey (kg),Meat,Kano,11000,7,77000,8800,15,No,10000
"Jul 19, 25",Yam Tuber (Large),Produce,Ibadan,12000,12,144000,8000,188,No,0
2025.07.20,Indomie Super Pack,Noodles,Lagos (Lekki),20000,4,80000,16800,18,No,50000
20-07-2025,Milo Refill 500g,Beverages,Port Harcourt,7200,29,208800,6000,176,No,0
"Jul 20, 25",Local Rice (50kg),Grains,Kano,120000,10,1200000,105000,154,No,5000
20-07-2025,Frozen Turkey (kg),Meat,Lagos (Ikeja),11000,-2,0,8800,90,No,5000
21-07-2025,Semovita 10kg,Swallow,Abuja,10500,7,73500,9200,109,No,0
2025.07.21,Yellow Garri (Paint),Tubers,Enugu,5500,30,165000,4200,69,No,0
"Jul 21, 25",Indomie Super Pack,Noodles,Kano,20000,26,520000,16800,70,No,0
21-07-2025,Indomie Super Pack,Noodles,Kano,20000,19,380000,16800,175,No,50000
22-07-2025,Yellow Garri (Paint),Tubers,Lagos (Lekki),5500,13,71500,4200,119,No,10000
"Jul 22, 25",Yellow Garri (Paint),Tubers,Ibadan,5500,19,104500,4200,110,No,5000
22/07/2025,Beans Brown (Oloyin),Grains,Ibadan,4500,30,135000,3200,144,No,5000
2025.07.22,Peak Milk 400g,Dairy,Enugu,Promo Price: 5300,16,92800,4900,130,No,5000
2025.07.23,Semovita 10kg,Swallow,Ibadan,10500,2,21000,9200,34,No,5000
2025.07.23,Dangote Sugar 1kg,Sweeteners,Abuja,4000,10,40000,3200,175,No,10000
23/07/2025,Local Rice (50kg),Grains,Enugu,120000,18,2160000,105000,26,No,5000
2025.07.23,Semovita 10kg,Swallow,Abuja,10500,22,231000,9200,102,No,50000
2025.07.24,Frozen Turkey (kg),Meat,Ibadan,11000,14,154000,8800,188,Yes,10000
2025-07-24,Yellow Garri (Paint),Tubers,Enugu,5500,28,154000,4200,180,No,5000
2025.07.24,Kings Oil 5L,Oils,Kano,27000,23,621000,21500,135,No,10000
24/07/2025,Frozen Turkey (kg),Meat,Ibadan,11000,23,253000,8800,116,No,10000
2025.07.25,Yam Tuber (Large),Produce,Ibadan,12000,9,108000,8000,196,Yes,50000
25/07/2025,Semovita 10kg,Swallow,Abuja,10500,30,315000,9200,171,No,5000
25/07/2025,Semovita 10kg,Swallow,Abuja,10500,14,147000,9200,135,No,0
25-07-2025,Semovita 10kg,Swallow,Lagos (Ikeja),10500,5,52500,9200,99,No,0
26-07-2025,Kings Oil 5L,Oils,Lagos (Ikeja),27000,17,459000,21500,29,No,50000
26-07-2025,Kings Oil 5L,Oils,Lagos (Lekki),27000,4,108000,21500,94,No,0
"Jul 26, 25",Yam Tuber (Large),Produce,Enugu,12000,2,24000,8000,44,No,10000
"Jul 26, 25",Yam Tuber (Large),Produce,Kano,12000,29,348000,8000,42,No,5000
"Jul 27, 25",Semovita 10kg,Swallow,Abuja,NGN 10500,30,315000,9200,82,No,0
2025-07-27,Yellow Garri (Paint),Tubers,Lagos (Ikeja),Promo Price: 5000,1,5500,4200,87,No,10000
2025.07.27,Yellow Garri (Paint),Tubers,Abuja,5500,23,126500,4200,51,No,50000
2025-07-27,Yam Tuber (Large),Produce,Lagos (Ikeja),12000,13,156000,8000,92,No,0
"Jul 28, 25",Peak Milk 400g,Dairy,Kano,5800,17,98600,4900,163,No,0
28-07-2025,Kings Oil 5L,Oils,Abuja,27000,24,648000,21500,146,No,10000
2025-07-28,Dangote Sugar 1kg,Sweeteners,Port Harcourt,4000,-2,0,3200,136,No,10000
2025-07-28,Semovita 10kg,Swallow,Enugu,10500,9,94500,9200,137,No,50000
29/07/2025,Milo Refill 500g,Beverages,Lagos (Lekki),7200,11,79200,6000,100,Yes,50000
"Jul 29, 25",Kings Oil 5L,Oils,Port Harcourt,27000,28,756000,21500,95,Yes,0
29-07-2025,Yellow Garri (Paint),Tubers,Enugu,5500,1,5500,4200,161,No,5000
2025.07.29,Milo Refill 500g,Beverages,Abuja,7200,-1,0,6000,171,Yes,50000
"Jul 30, 25",Yellow Garri (Paint),Tubers,Kano,5500,24,132000,4200,102,No,5000
"Jul 30, 25",Power Oil (Sachet),Oils,Enugu,NGN 500,7,3500,400,20,No,50000
2025-07-30,Yellow Garri (Paint),Tubers,Kano,5500,18,99000,4200,29,No,0
30-07-2025,Yellow Garri (Paint),Tubers,Kano,5500,25,137500,4200,81,No,5000
31/07/2025,Power Oil (Sachet),Oils,Port Harcourt,500,1,500,400,200,No,50000
"Jul 31, 25",Frozen Turkey (kg),Meat,Lagos (Ikeja),11000,-2,0,8800,110,No,0
2025-07-31,Milo Refill 500g,Beverages,Port Harcourt,7200,5,36000,6000,51,Yes,50000
2025-07-31,Milo Refill 500g,Beverages,Kano,7200,20,144000,6000,109,No,5000
2025.08.01,Frozen Turkey (kg),Meat,Abuja,11000,12,132000,8800,156,Yes,10000
"Aug 01, 25",Yellow Garri (Paint),Tubers,Ibadan,5500,8,44000,4200,176,No,50000
2025.08.01,Power Oil (Sachet),Oils,Port Harcourt,500,14,7000,400,196,No,5000
"Aug 01, 25",Milo Refill 500g,Beverages,Lagos (Lekki),7200,-2,0,6000,70,No,50000
02-08-2025,Local Rice (50kg),Grains,Port Harcourt,Promo Price: 119500,17,2040000,105000,11,No,0
2025.08.02,Indomie Super Pack,Noodles,Kano,20000,11,220000,16800,124,No,10000
2025.08.02,Indomie Super Pack,Noodles,Lagos (Ikeja),Promo Price: 19500,28,560000,16800,22,No,0
2025-08-02,Kings Oil 5L,Oils,Abuja,27000,7,189000,21500,177,Yes,0
2025.08.03,Peak Milk 400g,Dairy,Enugu,Promo Price: 5300,2,11600,4900,165,Yes,5000
2025.08.03,Yam Tuber (Large),Produce,Kano,12000,12,144000,8000,87,Yes,5000
2025.08.03,Indomie Super Pack,Noodles,Abuja,20000,24,480000,16800,177,No,10000
03/08/2025,Frozen Turkey (kg),Meat,Lagos (Ikeja),11000,4,44000,8800,115,No,10000
04-08-2025,Indomie Super Pack,Noodles,Lagos (Lekki),20000,16,320000,16800,188,Yes,5000
2025.08.04,Peak Milk 400g,Dairy,Enugu,5800,24,139200,4900,161,No,50000
04-08-2025,Frozen Turkey (kg),Meat,Port Harcourt,11000,5,55000,8800,13,No,5000
2025-08-04,Milo Refill 500g,Beverages,Enugu,7200,16,115200,6000,174,No,0
2025-08-05,Semovita 10kg,Swallow,Enugu,10500,3,31500,9200,29,No,0
2025.08.05,Yam Tuber (Large),Produce,Enugu,12000,7,84000,8000,60,Yes,0
2025-08-05,Milo Refill 500g,Beverages,Lagos (Lekki),7200,-1,0,6000,180,Yes,0
"Aug 05, 25",Dangote Sugar 1kg,Sweeteners,Ibadan,4000,26,104000,3200,152,No,10000
06-08-2025,Local Rice (50kg),Grains,Port Harcourt,120000,10,1200000,105000,10,No,5000
06/08/2025,Yellow Garri (Paint),Tubers,Lagos (Ikeja),5500,28,154000,4200,196,No,0
2025.08.06,Peak Milk 400g,Dairy,Kano,5800,28,162400,4900,48,No,5000
2025-08-06,Beans Brown (Oloyin),Grains,Port Harcourt,4500,-2,0,3200,176,Yes,50000
2025-08-07,Dangote Sugar 1kg,Sweeteners,Kano,4000,25,100000,3200,121,No,50000
07/08/2025,Dangote Sugar 1kg,Sweeteners,Lagos (Lekki),4000,23,92000,3200,140,No,0
2025-08-07,Frozen Turkey (kg),Meat,Kano,11000,22,242000,8800,67,Yes,10000
"Aug 07, 25",Yam Tuber (Large),Produce,Lagos (Lekki),12000,24,288000,8000,106,No,0
08-08-2025,Dangote Sugar 1kg,Sweeteners,Lagos (Lekki),4000,15,60000,3200,92,No,10000
"Aug 08, 25",Yam Tuber (Large),Produce,Enugu,12000,30,360000,8000,135,Yes,50000
2025-08-08,Yam Tuber (Large),Produce,Abuja,12000,30,360000,8000,14,No,5000
2025-08-08,Peak Milk 400g,Dairy,Ibadan,5800,7,40600,4900,157,No,50000
2025.08.09,Dangote Sugar 1kg,Sweeteners,Lagos (Lekki),4000,26,104000,3200,72,No,0
2025.08.09,Indomie Super Pack,Noodles,Kano,20000,12,240000,16800,135,Yes,10000
09/08/2025,Power Oil (Sachet),Oils,Abuja,Promo Price: 0,17,8500,400,130,No,0
"Aug 09, 25",Indomie Super Pack,Noodles,Lagos (Ikeja),20000,25,500000,16800,47,No,5000
10/08/2025,Beans Brown (Oloyin),Grains,Port Harcourt,4500,9,40500,3200,15,No,10000
2025.08.10,Local Rice (50kg),Grains,Lagos (Ikeja),120000,3,360000,105000,174,No,10000
"Aug 10, 25",Dangote Sugar 1kg,Sweeteners,Port Harcourt,4000,5,20000,3200,98,No,50000
10-08-2025,Local Rice (50kg),Grains,Ibadan,120000,7,840000,105000,185,Yes,5000
11-08-2025,Power Oil (Sachet),Oils,Enugu,500,6,3000,400,142,No,10000
2025-08-11,Kings Oil 5L,Oils,Abuja,27000,26,702000,21500,199,No,10000
11/08/2025,Yam Tuber (Large),Produce,Lagos (Lekki),12000,11,132000,8000,60,No,50000
11-08-2025,Semovita 10kg,Swallow,Ibadan,10500,15,157500,9200,102,No,5000
2025-08-12,Local Rice (50kg),Grains,Abuja,120000,18,2160000,105000,163,No,50000
2025.08.12,Milo Refill 500g,Beverages,Kano,7200,18,129600,6000,142,No,5000
12-08-2025,Indomie Super Pack,Noodles,Lagos (Ikeja),20000,12,240000,16800,90,No,10000
12/08/2025,Indomie Super Pack,Noodles,Ibadan,20000,-2,0,16800,108,No,50000
2025.08.13,Indomie Super Pack,Noodles,Enugu,20000,15,300000,16800,14,No,5000
"Aug 13, 25",Local Rice (50kg),Grains,Lagos (Ikeja),120000,29,3480000,105000,200,No,0
"Aug 13, 25",Local Rice (50kg),Grains,Kano,120000,23,2760000,105000,157,No,5000
2025-08-13,Beans Brown (Oloyin),Grains,Port Harcourt,4500,20,90000,3200,98,No,0
2025-08-14,Semovita 10kg,Swallow,Port Harcourt,10500,25,262500,9200,16,No,0
14-08-2025,Beans Brown (Oloyin),Grains,Enugu,NGN 4500,16,72000,3200,60,Yes,50000
2025.08.14,Milo Refill 500g,Beverages,Ibadan,7200,20,144000,6000,109,No,10000
2025.08.14,Indomie Super Pack,Noodles,Kano,20000,16,320000,16800,10,No,0
"Aug 15, 25",Power Oil (Sachet),Oils,Enugu,500,6,3000,400,56,No,50000
2025.08.15,Milo Refill 500g,Beverages,Abuja,7200,27,194400,6000,158,Yes,50000
15-08-2025,Beans Brown (Oloyin),Grains,Enugu,4500,22,99000,3200,53,No,50000
Last Friday,Kings Oil 5L,Oils,Lagos (Lekki),27000,15,405000,21500,172,No,5000
"Aug 16, 25",Yellow Garri (Paint),Tubers,Enugu,5500,1,5500,4200,190,No,5000
16/08/2025,Yellow Garri (Paint),Tubers,Ibadan,5500,23,126500,4200,28,Yes,5000
16/08/2025,Beans Brown (Oloyin),Grains,Kano,4500,26,117000,3200,143,No,50000
16-08-2025,Kings Oil 5L,Oils,Abuja,27000,10,270000,21500,36,No,0
17/08/2025,Local Rice (50kg),Grains,Lagos (Ikeja),120000,5,600000,105000,89,No,5000
2025.08.17,Dangote Sugar 1kg,Sweeteners,Lagos (Ikeja),4000,14,56000,3200,100,No,10000
2025.08.17,Local Rice (50kg),Grains,Port Harcourt,Promo Price: 119500,13,1560000,105000,57,Yes,5000
17/08/2025,Power Oil (Sachet),Oils,Enugu,500,20,10000,400,103,No,5000
18-08-2025,Milo Refill 500g,Beverages,Abuja,NGN 7200,17,122400,6000,83,No,0
18/08/2025,Peak Milk 400g,Dairy,Kano,5800,2,11600,4900,196,No,5000
2025.08.18,Frozen Turkey (kg),Meat,Port Harcourt,NGN 11000,-1,0,8800,91,No,0
18/08/2025,Kings Oil 5L,Oils,Enugu,27000,1,27000,21500,89,No,5000
2025.08.19,Power Oil (Sachet),Oils,Abuja,500,24,12000,400,153,No,5000
"Aug 19, 25",Peak Milk 400g,Dairy,Lagos (Ikeja),5800,28,162400,4900,39,No,5000
2025-08-19,Peak Milk 400g,Dairy,Kano,5800,0,0,4900,71,No,0
2025.08.19,Yam Tuber (Large),Produce,Lagos (Ikeja),12000,18,216000,8000,106,No,5000
"Aug 20, 25",Semovita 10kg,Swallow,Lagos (Ikeja),10500,25,262500,9200,38,No,0
2025.08.20,Frozen Turkey (kg),Meat,Enugu,11000,13,143000,8800,175,No,50000
2025.08.20,Beans Brown (Oloyin),Grains,Lagos (Ikeja),4500,23,103500,3200,76,No,0
"Aug 20, 25",Semovita 10kg,Swallow,Enugu,10500,23,241500,9200,144,No,0
2025-08-21,Power Oil (Sachet),Oils,Lagos (Ikeja),Promo Price: 0,21,10500,400,112,No,0
21/08/2025,Frozen Turkey (kg),Meat,Ibadan,11000,6,66000,8800,161,No,10000
21/08/2025,Beans Brown (Oloyin),Grains,Ibadan,4500,1,4500,3200,123,Yes,10000
21/08/2025,Indomie Super Pack,Noodles,Lagos (Lekki),NGN 20000,3,60000,16800,133,Yes,50000
2025-08-22,Local Rice (50kg),Grains,Kano,120000,9,1080000,105000,181,No,50000
2025.08.22,Semovita 10kg,Swallow,Port Harcourt,10500,6,63000,9200,70,Yes,5000
22/08/2025,Local Rice (50kg),Grains,Lagos (Ikeja),120000,5,600000,105000,11,No,5000
2025.08.22,Frozen Turkey (kg),Meat,Lagos (Lekki),11000,-2,0,8800,133,No,0
2025.08.23,Yam Tuber (Large),Produce,Kano,12000,3,36000,8000,53,Yes,0
23-08-2025,Semovita 10kg,Swallow,Lagos (Ikeja),Promo Price: 10000,27,283500,9200,46,No,0
23/08/2025,Milo Refill 500g,Beverages,Ibadan,7200,-1,0,6000,59,No,50000
2025.08.23,Dangote Sugar 1kg,Sweeteners,Enugu,4000,17,68000,3200,98,No,5000
2025-08-24,Kings Oil 5L,Oils,Lagos (Lekki),27000,21,567000,21500,24,Yes,50000
"Aug 24, 25",Milo Refill 500g,Beverages,Port Harcourt,Promo Price: 6700,27,194400,6000,168,No,50000
24/08/2025,Local Rice (50kg),Grains,Port Harcourt,120000,16,1920000,105000,143,No,10000
"Aug 24, 25",Yellow Garri (Paint),Tubers,Ibadan,5500,8,44000,4200,151,No,5000
25-08-2025,Semovita 10kg,Swallow,Abuja,10500,14,147000,9200,30,No,0
25-08-2025,Dangote Sugar 1kg,Sweeteners,Ibadan,4000,-1,0,3200,61,No,10000
25/08/2025,Peak Milk 400g,Dairy,Lagos (Ikeja),5800,30,174000,4900,185,No,0
25/08/2025,Beans Brown (Oloyin),Grains,Ibadan,4500,28,126000,3200,132,No,10000
2025-08-26,Indomie Super Pack,Noodles,Lagos (Ikeja),20000,3,60000,16800,143,No,10000
2025-08-26,Semovita 10kg,Swallow,Ibadan,10500,29,304500,9200,142,Yes,0
26/08/2025,Semovita 10kg,Swallow,Lagos (Lekki),10500,19,199500,9200,168,No,10000
26/08/2025,Indomie Super Pack,Noodles,Port Harcourt,20000,-2,0,16800,147,No,5000
2025-08-27,Beans Brown (Oloyin),Grains,Lagos (Lekki),4500,5,22500,3200,150,No,0
27-08-2025,Milo Refill 500g,Beverages,Lagos (Lekki),NGN 7200,13,93600,6000,196,No,0
27-08-2025,Frozen Turkey (kg),Meat,Ibadan,11000,15,165000,8800,107,Yes,50000
27/08/2025,Peak Milk 400g,Dairy,Lagos (Lekki),5800,16,92800,4900,135,No,50000
28/08/2025,Peak Milk 400g,Dairy,Ibadan,5800,1,5800,4900,12,Yes,0
2025.08.28,Yam Tuber (Large),Produce,Lagos (Lekki),12000,24,288000,8000,132,No,10000
"Aug 28, 25",Yellow Garri (Paint),Tubers,Abuja,5500,11,60500,4200,74,No,0
2025-08-28,Power Oil (Sachet),Oils,Ibadan,500,10,5000,400,128,No,0
2025.08.29,Local Rice (50kg),Grains,Lagos (Lekki),120000,17,2040000,105000,181,No,10000
2025.08.29,Beans Brown (Oloyin),Grains,Ibadan,4500,4,18000,3200,60,No,0
29/08/2025,Beans Brown (Oloyin),Grains,Lagos (Lekki),NGN 4500,8,36000,3200,109,No,5000
2025-08-29,Local Rice (50kg),Grains,Ibadan,Promo Price: 119500,23,2760000,105000,131,No,50000
30/08/2025,Dangote Sugar 1kg,Sweeteners,Ibadan,Promo Price: 3500,9,36000,3200,68,No,0
2025.08.30,Frozen Turkey (kg),Meat,Abuja,11000,4,44000,8800,119,No,0
2025.08.30,Local Rice (50kg),Grains,Kano,120000,20,2400000,105000,52,No,0
30-08-2025,Beans Brown (Oloyin),Grains,Lagos (Ikeja),4500,6,27000,3200,59,No,0
"Aug 31, 25",Semovita 10kg,Swallow,Enugu,10500,16,168000,9200,31,No,0
2025-08-31,Frozen Turkey (kg),Meat,Kano,11000,12,132000,8800,81,No,5000
"Aug 31, 25",Semovita 10kg,Swallow,Lagos (Ikeja),10500,24,252000,9200,61,Yes,0
"Aug 31, 25",Semovita 10kg,Swallow,Enugu,NGN 10500,1,10500,9200,73,No,50000
"Sep 01, 25",Beans Brown (Oloyin),Grains,Abuja,4500,9,40500,3200,23,No,0
2025.09.01,Yam Tuber (Large),Produce,Ibadan,12000,2,24000,8000,118,Yes,0
01/09/2025,Indomie Super Pack,Noodles,Enugu,20000,27,540000,16800,19,No,5000
2025.09.01,Frozen Turkey (kg),Meat,Kano,NGN 11000,9,99000,8800,155,Yes,50000
2025-09-02,Semovita 10kg,Swallow,Port Harcourt,Promo Price: 10000,5,52500,9200,106,No,0
"Sep 02, 25",Indomie Super Pack,Noodles,Kano,20000,27,540000,16800,169,No,50000
02/09/2025,Yellow Garri (Paint),Tubers,Enugu,5500,21,115500,4200,174,No,10000
2025-09-02,Yellow Garri (Paint),Tubers,Lagos (Lekki),5500,25,137500,4200,121,No,0
2025-09-03,Yam Tuber (Large),Produce,Abuja,Promo Price: 11500,0,0,8000,21,No,50000
03-09-2025,Yam Tuber (Large),Produce,Ibadan,12000,12,144000,8000,115,No,5000
2025-09-03,Kings Oil 5L,Oils,Port Harcourt,27000,30,810000,21500,185,No,0
03/09/2025,Dangote Sugar 1kg,Sweeteners,Ibadan,4000,22,88000,3200,27,Yes,0
04-09-2025,Beans Brown (Oloyin),Grains,Lagos (Ikeja),4500,29,130500,3200,173,No,50000
"Sep 04, 25",Frozen Turkey (kg),Meat,Lagos (Ikeja),11000,5,55000,8800,77,No,5000
2025.09.04,Power Oil (Sachet),Oils,Lagos (Ikeja),500,21,10500,400,64,No,0
04-09-2025,Dangote Sugar 1kg,Sweeteners,Port Harcourt,4000,15,60000,3200,88,No,0
2025-09-05,Frozen Turkey (kg),Meat,Lagos (Lekki),Promo Price: 10500,12,132000,8800,42,No,10000
05-09-2025,Frozen Turkey (kg),Meat,Lagos (Lekki),11000,25,275000,8800,54,No,50000
2025.09.05,Peak Milk 400g,Dairy,Abuja,5800,19,110200,4900,70,No,50000
05-09-2025,Yam Tuber (Large),Produce,Ibadan,12000,19,228000,8000,40,No,10000
2025-09-06,Milo Refill 500g,Beverages,Abuja,NGN 7200,-2,0,6000,112,No,5000
2025-09-06,Kings Oil 5L,Oils,Abuja,27000,12,324000,21500,178,Yes,5000
06-09-2025,Yam Tuber (Large),Produce,Lagos (Lekki),12000,1,12000,8000,13,No,0
2025.09.06,Peak Milk 400g,Dairy,Lagos (Ikeja),5800,4,23200,4900,66,Yes,0
2025-09-07,Dangote Sugar 1kg,Sweeteners,Enugu,4000,13,52000,3200,122,Yes,5000
"Sep 07, 25",Frozen Turkey (kg),Meat,Lagos (Ikeja),11000,14,154000,8800,35,Yes,0
2025.09.07,Beans Brown (Oloyin),Grains,Ibadan,4500,24,108000,3200,23,No,0
"Sep 07, 25",Peak Milk 400g,Dairy,Lagos (Lekki),5800,14,81200,4900,77,Yes,0
2025.09.08,Semovita 10kg,Swallow,Lagos (Lekki),10500,22,231000,9200,55,No,5000
2025-09-08,Yam Tuber (Large),Produce,Enugu,12000,11,132000,8000,152,No,50000
"Sep 08, 25",Kings Oil 5L,Oils,Port Harcourt,27000,29,783000,21500,27,Yes,5000
2025-09-08,Dangote Sugar 1kg,Sweeteners,Port Harcourt,4000,6,24000,3200,36,No,5000
"Sep 09, 25",Yam Tuber (Large),Produce,Port Harcourt,12000,13,156000,8000,33,No,50000
"Sep 09, 25",Kings Oil 5L,Oils,Lagos (Lekki),27000,12,324000,21500,113,No,10000
"Sep 09, 25",Yellow Garri (Paint),Tubers,Port Harcourt,5500,13,71500,4200,103,Yes,0
2025-09-09,Power Oil (Sachet),Oils,Port Harcourt,500,12,6000,400,166,No,0
2025.09.10,Indomie Super Pack,Noodles,Port Harcourt,20000,-1,0,16800,37,No,5000
10-09-2025,Yellow Garri (Paint),Tubers,Ibadan,5500,6,33000,4200,153,No,50000
10-09-2025,Yellow Garri (Paint),Tubers,Kano,5500,8,44000,4200,125,No,10000
2025-09-10,Kings Oil 5L,Oils,Lagos (Ikeja),NGN 27000,3,81000,21500,113,No,0
2025-09-11,Semovita 10kg,Swallow,Ibadan,10500,17,178500,9200,80,No,0
11-09-2025,Local Rice (50kg),Grains,Kano,120000,20,2400000,105000,49,No,50000
11-09-2025,Local Rice (50kg),Grains,Lagos (Ikeja),120000,22,2640000,105000,32,Yes,50000
11/09/2025,Peak Milk 400g,Dairy,Lagos (Lekki),5800,1,5800,4900,88,No,0
2025.09.12,Beans Brown (Oloyin),Grains,Lagos (Ikeja),4500,17,76500,3200,95,No,5000
2025-09-12,Dangote Sugar 1kg,Sweeteners,Port Harcourt,4000,30,120000,3200,173,No,10000
12-09-2025,Milo Refill 500g,Beverages,Kano,7200,27,194400,6000,45,Yes,0
2025-09-12,Dangote Sugar 1kg,Sweeteners,Ibadan,Promo Price: 3500,30,120000,3200,126,No,5000
13-09-2025,Peak Milk 400g,Dairy,Lagos (Lekki),5800,21,121800,4900,58,No,5000
13/09/2025,Kings Oil 5L,Oils,Enugu,27000,20,540000,21500,137,No,10000
2025-09-13,Kings Oil 5L,Oils,Ibadan,27000,-2,0,21500,192,No,10000
13/09/2025,Power Oil (Sachet),Oils,Lagos (Lekki),500,18,9000,400,21,No,5000
2025.09.14,Local Rice (50kg),Grains,Ibadan,Promo Price: 119500,0,0,105000,178,No,0
14/09/2025,Yellow Garri (Paint),Tubers,Port Harcourt,5500,28,154000,4200,185,Yes,0
2025-09-14,Peak Milk 400g,Dairy,Port Harcourt,5800,3,17400,4900,81,No,0
2025.09.14,Indomie Super Pack,Noodles,Lagos (Lekki),NGN 20000,0,0,16800,183,No,50000
2025.09.15,Kings Oil 5L,Oils,Enugu,27000,16,432000,21500,25,Yes,0
2025-09-15,Semovita 10kg,Swallow,Ibadan,10500,1,10500,9200,93,No,0
15-09-2025,Yam Tuber (Large),Produce,Kano,12000,20,240000,8000,67,No,5000
15/09/2025,Kings Oil 5L,Oils,Enugu,27000,0,0,21500,42,No,50000
"Sep 16, 25",Beans Brown (Oloyin),Grains,Port Harcourt,4500,28,126000,3200,34,Yes,50000
16/09/2025,Yellow Garri (Paint),Tubers,Lagos (Lekki),5500,23,126500,4200,181,No,50000
2025.09.16,Beans Brown (Oloyin),Grains,Abuja,4500,9,40500,3200,63,No,5000
16/09/2025,Yam Tuber (Large),Produce,Port Harcourt,12000,14,168000,8000,49,No,0
2025.09.17,Peak Milk 400g,Dairy,Lagos (Lekki),5800,24,139200,4900,173,Yes,0
2025-09-17,Milo Refill 500g,Beverages,Enugu,7200,11,79200,6000,41,No,0
17/09/2025,Yellow Garri (Paint),Tubers,Lagos (Lekki),NGN 5500,15,82500,4200,126,No,5000
2025-09-17,Semovita 10kg,Swallow,Abuja,10500,22,231000,9200,33,No,0
2025-09-18,Frozen Turkey (kg),Meat,Abuja,11000,4,44000,8800,121,No,5000
18-09-2025,Local Rice (50kg),Grains,Lagos (Ikeja),120000,1,120000,105000,183,No,5000
2025-09-18,Yellow Garri (Paint),Tubers,Kano,5500,28,154000,4200,81,No,0
18-09-2025,Kings Oil 5L,Oils,Lagos (Lekki),27000,14,378000,21500,185,No,0
19-09-2025,Yam Tuber (Large),Produce,Port Harcourt,12000,24,288000,8000,154,No,0
2025-09-19,Peak Milk 400g,Dairy,Abuja,5800,21,121800,4900,11,Yes,50000
19/09/2025,Yam Tuber (Large),Produce,Abuja,12000,3,36000,8000,182,No,0
19/09/2025,Milo Refill 500g,Beverages,Kano,7200,19,136800,6000,84,Yes,0
2025.09.20,Semovita 10kg,Swallow,Ibadan,10500,27,283500,9200,161,Yes,0
2025.09.20,Milo Refill 500g,Beverages,Port Harcourt,7200,15,108000,6000,57,No,0
2025-09-20,Kings Oil 5L,Oils,Kano,27000,21,567000,21500,46,Yes,5000
2025.09.20,Milo Refill 500g,Beverages,Kano,7200,23,165600,6000,112,Yes,0
21-09-2025,Local Rice (50kg),Grains,Abuja,Promo Price: 119500,17,2040000,105000,195,No,0
"Sep 21, 25",Dangote Sugar 1kg,Sweeteners,Lagos (Ikeja),4000,27,108000,3200,152,Yes,5000
2025.09.21,Semovita 10kg,Swallow,Abuja,10500,9,94500,9200,158,No,50000
2025-09-21,Yam Tuber (Large),Produce,Kano,Promo Price: 11500,17,204000,8000,33,Yes,0
22-09-2025,Yam Tuber (Large),Produce,Enugu,12000,22,264000,8000,76,No,50000
"Sep 22, 25",Indomie Super Pack,Noodles,Abuja,20000,20,400000,16800,150,No,5000
2025.09.22,Milo Refill 500g,Beverages,Enugu,7200,13,93600,6000,199,No,0
"Sep 22, 25",Indomie Super Pack,Noodles,Abuja,20000,27,540000,16800,191,No,0
2025.09.23,Beans Brown (Oloyin),Grains,Kano,Promo Price: 4000,9,40500,3200,178,Yes,0
"Sep 23, 25",Yellow Garri (Paint),Tubers,Kano,5500,22,121000,4200,77,No,0
23-09-2025,Milo Refill 500g,Beverages,Enugu,7200,-2,0,6000,200,No,50000
2025.09.23,Yellow Garri (Paint),Tubers,Enugu,5500,12,66000,4200,84,No,0
24/09/2025,Local Rice (50kg),Grains,Lagos (Lekki),120000,21,2520000,105000,188,No,10000
"Sep 24, 25",Local Rice (50kg),Grains,Enugu,120000,0,0,105000,107,No,50000
2025.09.24,Frozen Turkey (kg),Meat,Kano,11000,21,231000,8800,123,Yes,50000
24/09/2025,Frozen Turkey (kg),Meat,Ibadan,11000,28,308000,8800,180,No,5000
2025-09-25,Yam Tuber (Large),Produce,Lagos (Ikeja),12000,11,132000,8000,29,No,10000
25/09/2025,Dangote Sugar 1kg,Sweeteners,Enugu,4000,2,8000,3200,39,No,0
25-09-2025,Beans Brown (Oloyin),Grains,Lagos (Ikeja),4500,7,31500,3200,42,No,5000
2025-09-25,Milo Refill 500g,Beverages,Ibadan,Promo Price: 6700,25,180000,6000,192,No,5000
2025.09.26,Local Rice (50kg),Grains,Port Harcourt,120000,9,1080000,105000,200,No,10000
26/09/2025,Beans Brown (Oloyin),Grains,Enugu,4500,29,130500,3200,21,No,50000
2025-09-26,Yellow Garri (Paint),Tubers,Port Harcourt,5500,11,60500,4200,107,No,0
"Sep 26, 25",Yellow Garri (Paint),Tubers,Abuja,5500,26,143000,4200,61,No,5000
27/09/2025,Local Rice (50kg),Grains,Enugu,120000,20,2400000,105000,143,No,50000
27/09/2025,Yellow Garri (Paint),Tubers,Lagos (Lekki),5500,28,154000,4200,68,No,0
27-09-2025,Indomie Super Pack,Noodles,Ibadan,20000,2,40000,16800,104,No,10000
27-09-2025,Milo Refill 500g,Beverages,Port Harcourt,7200,18,129600,6000,71,No,5000
2025.09.28,Power Oil (Sachet),Oils,Lagos (Ikeja),500,7,3500,400,189,Yes,50000
2025.09.28,Semovita 10kg,Swallow,Kano,10500,11,115500,9200,64,No,50000
2025.09.28,Semovita 10kg,Swallow,Enugu,10500,10,105000,9200,190,No,10000
2025.09.28,Power Oil (Sachet),Oils,Lagos (Ikeja),500,1,500,400,110,No,50000
29-09-2025,Kings Oil 5L,Oils,Abuja,27000,18,486000,21500,137,No,0
29/09/2025,Indomie Super Pack,Noodles,Lagos (Lekki),20000,3,60000,16800,56,No,0
29-09-2025,Power Oil (Sachet),Oils,Kano,500,6,3000,400,21,No,0
29/09/2025,Local Rice (50kg),Grains,Kano,NGN 120000,0,0,105000,159,No,5000
2025.09.30,Dangote Sugar 1kg,Sweeteners,Lagos (Ikeja),4000,14,56000,3200,110,No,5000
30/09/2025,Dangote Sugar 1kg,Sweeteners,Lagos (Ikeja),4000,19,76000,3200,29,No,50000
2025-09-30,Milo Refill 500g,Beverages,Lagos (Ikeja),7200,4,28800,6000,136,No,10000
2025-09-30,Semovita 10kg,Swallow,Lagos (Ikeja),10500,14,147000,9200,42,No,10000
2025.10.01,Dangote Sugar 1kg,Sweeteners,Lagos (Ikeja),4000,27,108000,3200,196,No,0
"Oct 01, 25",Beans Brown (Oloyin),Grains,Port Harcourt,4500,26,117000,3200,183,Yes,5000
2025-10-01,Frozen Turkey (kg),Meat,Port Harcourt,11000,21,231000,8800,42,No,50000
"Oct 01, 25",Milo Refill 500g,Beverages,Kano,7200,5,36000,6000,194,No,0
02/10/2025,Kings Oil 5L,Oils,Abuja,27000,13,351000,21500,48,No,10000
02-10-2025,Kings Oil 5L,Oils,Kano,27000,21,567000,21500,85,Yes,50000
02/10/2025,Local Rice (50kg),Grains,Lagos (Lekki),120000,-1,0,105000,188,Yes,10000
2025-10-02,Semovita 10kg,Swallow,Ibadan,10500,0,0,9200,16,No,10000
2025-10-03,Semovita 10kg,Swallow,Ibadan,10500,10,105000,9200,10,No,0
03-10-2025,Yam Tuber (Large),Produce,Port Harcourt,12000,-1,0,8000,185,No,50000
"Oct 03, 25",Indomie Super Pack,Noodles,Ibadan,20000,24,480000,16800,73,Yes,0
03/10/2025,Local Rice (50kg),Grains,Enugu,120000,30,3600000,105000,163,Yes,10000
04/10/2025,Beans Brown (Oloyin),Grains,Port Harcourt,4500,0,0,3200,140,No,5000
"Oct 04, 25",Indomie Super Pack,Noodles,Lagos (Ikeja),20000,20,400000,16800,15,Yes,0
2025.10.04,Kings Oil 5L,Oils,Enugu,27000,5,135000,21500,103,No,50000
2025-10-04,Beans Brown (Oloyin),Grains,Lagos (Lekki),4500,23,103500,3200,176,Yes,50000
"Oct 05, 25",Local Rice (50kg),Grains,Port Harcourt,120000,18,2160000,105000,34,No,0
05-10-2025,Dangote Sugar 1kg,Sweeteners,Abuja,4000,6,24000,3200,130,Yes,50000
2025.10.05,Power Oil (Sachet),Oils,Ibadan,500,6,3000,400,193,No,50000
05/10/2025,Yellow Garri (Paint),Tubers,Abuja,5500,8,44000,4200,38,No,5000
"Oct 06, 25",Milo Refill 500g,Beverages,Ibadan,NGN 7200,29,208800,6000,107,Yes,50000
06/10/2025,Semovita 10kg,Swallow,Lagos (Ikeja),10500,6,63000,9200,62,No,10000
"Oct 06, 25",Local Rice (50kg),Grains,Abuja,120000,10,1200000,105000,123,No,50000
2025-10-06,Dangote Sugar 1kg,Sweeteners,Port Harcourt,4000,-2,0,3200,36,No,0
2025-10-07,Milo Refill 500g,Beverages,Lagos (Lekki),7200,-2,0,6000,21,No,0
2025-10-07,Local Rice (50kg),Grains,Abuja,120000,4,480000,105000,197,No,5000
07/10/2025,Dangote Sugar 1kg,Sweeteners,Kano,4000,7,28000,3200,134,Yes,50000
07-10-2025,Peak Milk 400g,Dairy,Kano,5800,15,87000,4900,73,No,0
08-10-2025,Yam Tuber (Large),Produce,Enugu,12000,2,24000,8000,133,No,0
2025-10-08,Beans Brown (Oloyin),Grains,Lagos (Ikeja),4500,29,130500,3200,165,No,0
2025-10-08,Power Oil (Sachet),Oils,Enugu,500,-1,0,400,28,No,5000
08-10-2025,Dangote Sugar 1kg,Sweeteners,Ibadan,4000,26,104000,3200,103,Yes,50000
09-10-2025,Indomie Super Pack,Noodles,Kano,20000,29,580000,16800,74,Yes,0
2025.10.09,Beans Brown (Oloyin),Grains,Kano,4500,-1,0,3200,132,No,5000
09-10-2025,Yam Tuber (Large),Produce,Abuja,Promo Price: 11500,24,288000,8000,49,No,0
09-10-2025,Peak Milk 400g,Dairy,Enugu,5800,24,139200,4900,77,Yes,5000
"Oct 10, 25",Peak Milk 400g,Dairy,Abuja,5800,8,46400,4900,61,No,5000
10/10/2025,Beans Brown (Oloyin),Grains,Ibadan,Promo Price: 4000,17,76500,3200,66,No,10000
2025-10-10,Frozen Turkey (kg),Meat,Lagos (Ikeja),11000,14,154000,8800,34,No,0
2025-10-10,Indomie Super Pack,Noodles,Ibadan,20000,10,200000,16800,60,Yes,10000
2025-10-11,Indomie Super Pack,Noodles,Kano,20000,8,160000,16800,163,Yes,5000
2025.10.11,Yellow Garri (Paint),Tubers,Ibadan,5500,30,165000,4200,22,No,0
2025-10-11,Frozen Turkey (kg),Meat,Kano,11000,25,275000,8800,59,No,50000
11/10/2025,Kings Oil 5L,Oils,Abuja,27000,15,405000,21500,153,No,0
"Oct 12, 25",Power Oil (Sachet),Oils,Lagos (Lekki),Promo Price: 0,27,13500,400,130,Yes,10000
12/10/2025,Yam Tuber (Large),Produce,Port Harcourt,12000,23,276000,8000,147,No,50000
12/10/2025,Yellow Garri (Paint),Tubers,Port Harcourt,5500,12,66000,4200,189,No,10000
12-10-2025,Yam Tuber (Large),Produce,Abuja,12000,13,156000,8000,100,Yes,0
2025.10.13,Frozen Turkey (kg),Meat,Port Harcourt,11000,28,308000,8800,167,No,10000
"Oct 13, 25",Local Rice (50kg),Grains,Kano,120000,5,600000,105000,35,Yes,5000
13-10-2025,Beans Brown (Oloyin),Grains,Enugu,4500,9,40500,3200,13,No,50000
13-10-2025,Beans Brown (Oloyin),Grains,Enugu,NGN 4500,19,85500,3200,199,Yes,50000
2025-10-14,Frozen Turkey (kg),Meat,Abuja,Promo Price: 10500,-1,0,8800,76,No,5000
14/10/2025,Beans Brown (Oloyin),Grains,Lagos (Ikeja),4500,4,18000,3200,37,No,0
2025.10.14,Local Rice (50kg),Grains,Lagos (Lekki),120000,0,0,105000,197,No,0
14-10-2025,Kings Oil 5L,Oils,Ibadan,27000,27,729000,21500,65,No,0
2025.10.15,Yellow Garri (Paint),Tubers,Lagos (Lekki),5500,6,33000,4200,44,No,0
"Oct 15, 25",Frozen Turkey (kg),Meat,Port Harcourt,11000,25,275000,8800,24,No,5000
"Oct 15, 25",Beans Brown (Oloyin),Grains,Enugu,4500,17,76500,3200,190,No,5000
15-10-2025,Milo Refill 500g,Beverages,Lagos (Ikeja),NGN 7200,-2,0,6000,73,Yes,5000
16-10-2025,Kings Oil 5L,Oils,Ibadan,27000,12,324000,21500,199,No,10000
16/10/2025,Frozen Turkey (kg),Meat,Ibadan,11000,24,264000,8800,34,No,0
16/10/2025,Indomie Super Pack,Noodles,Lagos (Lekki),20000,18,360000,16800,159,No,5000
2025.10.16,Semovita 10kg,Swallow,Lagos (Lekki),10500,28,294000,9200,37,No,50000
17/10/2025,Yam Tuber (Large),Produce,Port Harcourt,NGN 12000,15,180000,8000,40,No,10000
17/10/2025,Beans Brown (Oloyin),Grains,Kano,4500,8,36000,3200,33,No,5000
17/10/2025,Frozen Turkey (kg),Meat,Abuja,NGN 11000,30,330000,8800,85,No,50000
2025.10.17,Power Oil (Sachet),Oils,Abuja,500,6,3000,400,198,No,50000
2025-10-18,Yam Tuber (Large),Produce,Lagos (Lekki),12000,2,24000,8000,88,No,0
2025-10-18,Frozen Turkey (kg),Meat,Ibadan,11000,-2,0,8800,119,No,0
18-10-2025,Yam Tuber (Large),Produce,Lagos (Ikeja),12000,14,168000,8000,42,Yes,0
18-10-2025,Indomie Super Pack,Noodles,Ibadan,20000,17,340000,16800,164,Yes,50000
2025-10-19,Power Oil (Sachet),Oils,Lagos (Ikeja),Promo Price: 0,26,13000,400,12,No,0
19/10/2025,Kings Oil 5L,Oils,Abuja,27000,20,540000,21500,21,No,10000
19-10-2025,Peak Milk 400g,Dairy,Abuja,5800,25,145000,4900,116,No,50000
2025-10-19,Kings Oil 5L,Oils,Abuja,27000,17,459000,21500,64,No,0
2025-10-20,Milo Refill 500g,Beverages,Lagos (Ikeja),7200,27,194400,6000,82,No,0
"Oct 20, 25",Frozen Turkey (kg),Meat,Ibadan,11000,0,0,8800,197,No,50000
20-10-2025,Frozen Turkey (kg),Meat,Kano,11000,4,44000,8800,12,Yes,10000
"Oct 20, 25",Semovita 10kg,Swallow,Abuja,10500,14,147000,9200,32,Yes,0
2025-10-21,Indomie Super Pack,Noodles,Lagos (Lekki),20000,-2,0,16800,66,No,50000
"Oct 21, 25",Semovita 10kg,Swallow,Lagos (Ikeja),10500,5,52500,9200,18,No,5000
2025-10-21,Yellow Garri (Paint),Tubers,Kano,5500,10,55000,4200,182,No,5000
21/10/2025,Dangote Sugar 1kg,Sweeteners,Port Harcourt,4000,0,0,3200,107,No,10000
"Oct 22, 25",Dangote Sugar 1kg,Sweeteners,Abuja,4000,-1,0,3200,182,No,10000
2025-10-22,Yam Tuber (Large),Produce,Kano,Promo Price: 11500,12,144000,8000,100,No,0
2025-10-22,Kings Oil 5L,Oils,Enugu,27000,13,351000,21500,136,No,50000
22/10/2025,Peak Milk 400g,Dairy,Lagos (Ikeja),5800,25,145000,4900,36,No,5000
2025.10.23,Frozen Turkey (kg),Meat,Kano,11000,21,231000,8800,133,No,0
23-10-2025,Semovita 10kg,Swallow,Ibadan,10500,2,21000,9200,40,No,0
"Oct 23, 25",Semovita 10kg,Swallow,Kano,10500,-2,0,9200,181,No,0
"Oct 23, 25",Milo Refill 500g,Beverages,Lagos (Ikeja),7200,1,7200,6000,138,No,5000
24-10-2025,Peak Milk 400g,Dairy,Lagos (Ikeja),5800,17,98600,4900,117,No,0
24/10/2025,Beans Brown (Oloyin),Grains,Kano,4500,1,4500,3200,67,No,0
"Oct 24, 25",Frozen Turkey (kg),Meat,Lagos (Ikeja),11000,24,264000,8800,68,No,0
2025.10.24,Kings Oil 5L,Oils,Kano,Promo Price: 26500,11,297000,21500,33,No,0
25-10-2025,Milo Refill 500g,Beverages,Enugu,7200,17,122400,6000,184,Yes,0
25-10-2025,Power Oil (Sachet),Oils,Lagos (Ikeja),Promo Price: 0,1,500,400,105,No,10000
2025.10.25,Yam Tuber (Large),Produce,Kano,12000,16,192000,8000,152,No,10000
25/10/2025,Milo Refill 500g,Beverages,Port Harcourt,7200,11,79200,6000,48,No,5000
"Oct 26, 25",Dangote Sugar 1kg,Sweeteners,Lagos (Lekki),4000,20,80000,3200,51,No,10000
"Oct 26, 25",Indomie Super Pack,Noodles,Lagos (Ikeja),20000,24,480000,16800,104,No,0
2025-10-26,Kings Oil 5L,Oils,Kano,27000,0,0,21500,112,Yes,5000
26/10/2025,Dangote Sugar 1kg,Sweeteners,Abuja,4000,30,120000,3200,82,No,5000
2025.10.27,Dangote Sugar 1kg,Sweeteners,Lagos (Ikeja),4000,15,60000,3200,58,Yes,5000
27/10/2025,Indomie Super Pack,Noodles,Ibadan,20000,3,60000,16800,93,No,0
2025.10.27,Yellow Garri (Paint),Tubers,Lagos (Ikeja),5500,0,0,4200,174,No,0
27-10-2025,Indomie Super Pack,Noodles,Ibadan,20000,5,100000,16800,86,No,10000
"Oct 28, 25",Beans Brown (Oloyin),Grains,Ibadan,4500,21,94500,3200,61,No,5000
2025.10.28,Indomie Super Pack,Noodles,Ibadan,20000,4,80000,16800,45,No,0
2025.10.28,Dangote Sugar 1kg,Sweeteners,Kano,4000,21,84000,3200,178,No,10000
2025.10.28,Beans Brown (Oloyin),Grains,Port Harcourt,4500,2,9000,3200,109,No,10000
"Oct 29, 25",Local Rice (50kg),Grains,Abuja,120000,4,480000,105000,62,No,5000
29/10/2025,Yellow Garri (Paint),Tubers,Ibadan,5500,28,154000,4200,154,No,50000
29-10-2025,Milo Refill 500g,Beverages,Port Harcourt,7200,26,187200,6000,23,No,0
29-10-2025,Milo Refill 500g,Beverages,Abuja,7200,-2,0,6000,103,No,0
"Oct 30, 25",Semovita 10kg,Swallow,Lagos (Ikeja),10500,16,168000,9200,20,No,0
30/10/2025,Local Rice (50kg),Grains,Ibadan,120000,0,0,105000,150,No,10000
30-10-2025,Frozen Turkey (kg),Meat,Lagos (Lekki),11000,19,209000,8800,169,No,5000
30-10-2025,Yellow Garri (Paint),Tubers,Lagos (Ikeja),5500,20,110000,4200,61,No,0
31-10-2025,Semovita 10kg,Swallow,Port Harcourt,10500,13,136500,9200,37,No,10000
31/10/2025,Local Rice (50kg),Grains,Kano,120000,24,2880000,105000,170,Yes,0
"Oct 31, 25",Kings Oil 5L,Oils,Kano,27000,28,756000,21500,181,No,0
31/10/2025,Peak Milk 400g,Dairy,Enugu,5800,6,34800,4900,71,No,50000
"Nov 01, 25",Dangote Sugar 1kg,Sweeteners,Lagos (Lekki),4000,25,100000,3200,143,No,50000
01-11-2025,Power Oil (Sachet),Oils,Ibadan,500,22,11000,400,42,Yes,10000
"Nov 01, 25",Peak Milk 400g,Dairy,Abuja,5800,24,139200,4900,172,No,10000
2025.11.01,Frozen Turkey (kg),Meat,Enugu,11000,4,44000,8800,114,No,0
02/11/2025,Semovita 10kg,Swallow,Lagos (Ikeja),10500,6,63000,9200,183,No,0
2025-11-02,Milo Refill 500g,Beverages,Kano,7200,17,122400,6000,105,Yes,0
"Nov 02, 25",Yellow Garri (Paint),Tubers,Kano,5500,18,99000,4200,121,No,50000
2025.11.02,Milo Refill 500g,Beverages,Lagos (Ikeja),7200,29,208800,6000,87,No,10000
2025.11.03,Semovita 10kg,Swallow,Port Harcourt,10500,-1,0,9200,162,No,0
2025-11-03,Yam Tuber (Large),Produce,Lagos (Ikeja),12000,-2,0,8000,164,No,0
03-11-2025,Yellow Garri (Paint),Tubers,Enugu,5500,12,66000,4200,83,Yes,5000
"Nov 03, 25",Kings Oil 5L,Oils,Enugu,27000,6,162000,21500,167,No,5000
04/11/2025,Local Rice (50kg),Grains,Lagos (Lekki),120000,25,3000000,105000,61,No,0
2025-11-04,Frozen Turkey (kg),Meat,Ibadan,11000,3,33000,8800,121,No,50000
"Nov 04, 25",Yellow Garri (Paint),Tubers,Kano,5500,5,27500,4200,25,No,5000
04/11/2025,Peak Milk 400g,Dairy,Port Harcourt,5800,10,58000,4900,189,Yes,50000
05/11/2025,Peak Milk 400g,Dairy,Lagos (Lekki),5800,10,58000,4900,108,No,10000
"Nov 05, 25",Yam Tuber (Large),Produce,Kano,Promo Price: 11500,19,228000,8000,22,No,5000
"Nov 05, 25",Indomie Super Pack,Noodles,Port Harcourt,20000,2,40000,16800,51,No,50000
05-11-2025,Local Rice (50kg),Grains,Abuja,120000,30,3600000,105000,43,Yes,50000
2025-11-06,Yellow Garri (Paint),Tubers,Lagos (Ikeja),5500,10,55000,4200,188,Yes,5000
2025-11-06,Power Oil (Sachet),Oils,Abuja,500,-2,0,400,49,No,0
06-11-2025,Semovita 10kg,Swallow,Abuja,10500,7,73500,9200,128,No,0
06/11/2025,Frozen Turkey (kg),Meat,Abuja,11000,20,220000,8800,107,No,5000
2025-11-07,Kings Oil 5L,Oils,Lagos (Lekki),27000,0,0,21500,129,No,50000
"Nov 07, 25",Local Rice (50kg),Grains,Port Harcourt,120000,14,1680000,105000,144,Yes,0
2025.11.07,Dangote Sugar 1kg,Sweeteners,Kano,4000,29,116000,3200,115,No,10000
07/11/2025,Indomie Super Pack,Noodles,Port Harcourt,20000,9,180000,16800,61,No,10000
08-11-2025,Peak Milk 400g,Dairy,Ibadan,5800,8,46400,4900,170,Yes,50000
2025.11.08,Power Oil (Sachet),Oils,Kano,500,4,2000,400,71,No,0
2025-11-08,Milo Refill 500g,Beverages,Enugu,Promo Price: 6700,22,158400,6000,13,No,50000
2025.11.08,Beans Brown (Oloyin),Grains,Port Harcourt,4500,5,22500,3200,131,No,0
2025.11.09,Kings Oil 5L,Oils,Kano,27000,22,594000,21500,103,Yes,0
09/11/2025,Milo Refill 500g,Beverages,Ibadan,7200,25,180000,6000,192,No,0
2025-11-09,Semovita 10kg,Swallow,Enugu,10500,6,63000,9200,155,Yes,50000
"Nov 09, 25",Peak Milk 400g,Dairy,Enugu,Promo Price: 5300,10,58000,4900,185,No,0
"Nov 10, 25",Kings Oil 5L,Oils,Enugu,27000,-1,0,21500,124,No,0
10/11/2025,Local Rice (50kg),Grains,Enugu,120000,5,600000,105000,98,No,5000
2025-11-10,Frozen Turkey (kg),Meat,Lagos (Lekki),11000,5,55000,8800,156,No,10000
10/11/2025,Peak Milk 400g,Dairy,Abuja,5800,7,40600,4900,164,No,0
11/11/2025,Local Rice (50kg),Grains,Abuja,120000,5,600000,105000,107,No,5000
11/11/2025,Milo Refill 500g,Beverages,Lagos (Ikeja),7200,19,136800,6000,60,No,10000
2025-11-11,Semovita 10kg,Swallow,Lagos (Ikeja),10500,18,189000,9200,51,No,50000
2025-11-11,Dangote Sugar 1kg,Sweeteners,Ibadan,4000,3,12000,3200,84,No,0
Last Friday,Local Rice (50kg),Grains,Abuja,NGN 120000,14,1680000,105000,198,No,0
12/11/2025,Semovita 10kg,Swallow,Enugu,10500,6,63000,9200,81,No,10000
2025.11.12,Power Oil (Sachet),Oils,Lagos (Lekki),500,24,12000,400,23,No,10000
2025-11-12,Semovita 10kg,Swallow,Kano,10500,29,304500,9200,54,No,0
"Nov 13, 25",Frozen Turkey (kg),Meat,Lagos (Ikeja),11000,30,330000,8800,50,No,0
"Nov 13, 25",Indomie Super Pack,Noodles,Kano,20000,16,320000,16800,84,No,0
2025.11.13,Semovita 10kg,Swallow,Abuja,10500,-2,0,9200,17,No,50000
2025.11.13,Yam Tuber (Large),Produce,Lagos (Ikeja),12000,22,264000,8000,80,No,10000
14/11/2025,Yellow Garri (Paint),Tubers,Ibadan,5500,9,49500,4200,118,Yes,50000
14-11-2025,Yam Tuber (Large),Produce,Ibadan,12000,14,168000,8000,22,No,10000
2025.11.14,Yellow Garri (Paint),Tubers,Kano,5500,23,126500,4200,178,No,10000
"Nov 14, 25",Kings Oil 5L,Oils,Abuja,27000,29,783000,21500,157,No,50000
15-11-2025,Indomie Super Pack,Noodles,Enugu,20000,7,140000,16800,58,Yes,0
2025.11.15,Yam Tuber (Large),Produce,Kano,12000,6,72000,8000,107,Yes,5000
15/11/2025,Indomie Super Pack,Noodles,Lagos (Lekki),20000,21,420000,16800,146,No,0
2025.11.15,Beans Brown (Oloyin),Grains,Abuja,4500,26,117000,3200,138,No,0
2025.11.16,Dangote Sugar 1kg,Sweeteners,Lagos (Lekki),4000,13,52000,3200,16,No,0
16/11/2025,Milo Refill 500g,Beverages,Lagos (Lekki),Promo Price: 6700,-1,0,6000,174,No,0
16/11/2025,Local Rice (50kg),Grains,Lagos (Lekki),120000,18,2160000,105000,58,Yes,50000
16/11/2025,Local Rice (50kg),Grains,Enugu,120000,23,2760000,105000,87,No,50000
17-11-2025,Indomie Super Pack,Noodles,Enugu,20000,24,480000,16800,99,No,10000
"Nov 17, 25",Yellow Garri (Paint),Tubers,Kano,5500,17,93500,4200,149,No,5000
2025.11.17,Kings Oil 5L,Oils,Port Harcourt,27000,1,27000,21500,138,No,10000
17/11/2025,Dangote Sugar 1kg,Sweeteners,Enugu,4000,7,28000,3200,66,No,0
18/11/2025,Local Rice (50kg),Grains,Lagos (Ikeja),120000,16,1920000,105000,34,No,0
"Nov 18, 25",Indomie Super Pack,Noodles,Enugu,20000,15,300000,16800,142,No,0
18-11-2025,Kings Oil 5L,Oils,Port Harcourt,27000,9,243000,21500,175,No,50000
"Nov 18, 25",Milo Refill 500g,Beverages,Kano,7200,8,57600,6000,124,No,10000
19-11-2025,Indomie Super Pack,Noodles,Lagos (Lekki),20000,15,300000,16800,126,No,5000
19/11/2025,Local Rice (50kg),Grains,Lagos (Lekki),120000,29,3480000,105000,189,No,5000
"Nov 19, 25",Milo Refill 500g,Beverages,Abuja,7200,15,108000,6000,21,No,0
"Nov 19, 25",Dangote Sugar 1kg,Sweeteners,Lagos (Ikeja),4000,25,100000,3200,45,No,0
2025-11-20,Peak Milk 400g,Dairy,Lagos (Ikeja),5800,22,127600,4900,176,No,0
"Nov 20, 25",Indomie Super Pack,Noodles,Lagos (Ikeja),20000,22,440000,16800,106,Yes,10000
20/11/2025,Local Rice (50kg),Grains,Abuja,120000,20,2400000,105000,191,Yes,0
20/11/2025,Yellow Garri (Paint),Tubers,Port Harcourt,5500,-2,0,4200,62,No,0
2025.11.21,Power Oil (Sachet),Oils,Port Harcourt,500,28,14000,400,145,Yes,0
21/11/2025,Peak Milk 400g,Dairy,Enugu,5800,6,34800,4900,164,No,5000
2025-11-21,Frozen Turkey (kg),Meat,Port Harcourt,11000,21,231000,8800,51,Yes,5000
2025-11-21,Semovita 10kg,Swallow,Lagos (Lekki),10500,23,241500,9200,68,No,50000
"Nov 22, 25",Kings Oil 5L,Oils,Port Harcourt,27000,9,243000,21500,130,No,5000
22/11/2025,Local Rice (50kg),Grains,Kano,120000,26,3120000,105000,87,No,50000
22/11/2025,Peak Milk 400g,Dairy,Lagos (Lekki),5800,20,116000,4900,79,Yes,10000
2025.11.22,Yellow Garri (Paint),Tubers,Lagos (Ikeja),5500,29,159500,4200,67,No,50000
23/11/2025,Semovita 10kg,Swallow,Ibadan,10500,23,241500,9200,178,Yes,5000
23-11-2025,Indomie Super Pack,Noodles,Port Harcourt,20000,13,260000,16800,37,Yes,10000
23/11/2025,Peak Milk 400g,Dairy,Lagos (Ikeja),NGN 5800,16,92800,4900,29,No,0
23/11/2025,Yellow Garri (Paint),Tubers,Kano,5500,25,137500,4200,170,Yes,0
2025-11-24,Frozen Turkey (kg),Meat,Abuja,11000,19,209000,8800,175,No,50000
2025.11.24,Peak Milk 400g,Dairy,Kano,5800,24,139200,4900,133,No,50000
24/11/2025,Indomie Super Pack,Noodles,Enugu,20000,0,0,16800,194,Yes,0
24-11-2025,Yam Tuber (Large),Produce,Abuja,12000,21,252000,8000,186,No,0
25/11/2025,Dangote Sugar 1kg,Sweeteners,Port Harcourt,4000,20,80000,3200,181,No,50000
2025.11.25,Dangote Sugar 1kg,Sweeteners,Port Harcourt,4000,0,0,3200,38,No,10000
"Nov 25, 25",Yellow Garri (Paint),Tubers,Enugu,5500,9,49500,4200,82,No,0
2025-11-25,Local Rice (50kg),Grains,Ibadan,NGN 120000,26,3120000,105000,45,Yes,5000
26/11/2025,Yam Tuber (Large),Produce,Kano,12000,24,288000,8000,51,No,0
"Nov 26, 25",Dangote Sugar 1kg,Sweeteners,Enugu,4000,29,116000,3200,118,No,10000
2025-11-26,Indomie Super Pack,Noodles,Lagos (Lekki),20000,10,200000,16800,124,No,5000
26-11-2025,Kings Oil 5L,Oils,Ibadan,27000,22,594000,21500,197,No,0
2025-11-27,Beans Brown (Oloyin),Grains,Abuja,4500,-2,0,3200,58,No,10000
"Nov 27, 25",Dangote Sugar 1kg,Sweeteners,Port Harcourt,4000,30,120000,3200,137,No,50000
"Nov 27, 25",Dangote Sugar 1kg,Sweeteners,Kano,4000,8,32000,3200,180,No,50000
27-11-2025,Semovita 10kg,Swallow,Kano,10500,30,315000,9200,19,Yes,5000
28/11/2025,Milo Refill 500g,Beverages,Abuja,7200,6,43200,6000,149,No,0
2025-11-28,Kings Oil 5L,Oils,Lagos (Lekki),27000,10,270000,21500,12,No,0
28-11-2025,Semovita 10kg,Swallow,Enugu,10500,30,315000,9200,125,No,50000
2025-11-28,Local Rice (50kg),Grains,Ibadan,120000,22,2640000,105000,138,No,5000
29/11/2025,Frozen Turkey (kg),Meat,Lagos (Ikeja),11000,8,88000,8800,102,No,0
"Nov 29, 25",Local Rice (50kg),Grains,Lagos (Ikeja),120000,13,1560000,105000,63,No,10000
2025.11.29,Power Oil (Sachet),Oils,Ibadan,500,4,2000,400,193,Yes,10000
"Nov 29, 25",Kings Oil 5L,Oils,Kano,27000,9,243000,21500,56,No,50000
"Nov 30, 25",Kings Oil 5L,Oils,Port Harcourt,27000,-1,0,21500,194,No,0
"Nov 30, 25",Power Oil (Sachet),Oils,Enugu,500,21,10500,400,164,No,50000
2025.11.30,Milo Refill 500g,Beverages,Abuja,7200,-2,0,6000,52,Yes,0
30/11/2025,Yellow Garri (Paint),Tubers,Lagos (Lekki),5500,30,165000,4200,29,No,0
2025-12-01,Frozen Turkey (kg),Meat,Port Harcourt,11000,23,253000,8800,79,Yes,10000
2025.12.01,Semovita 10kg,Swallow,Ibadan,10500,7,73500,9200,178,No,5000
01-12-2025,Kings Oil 5L,Oils,Port Harcourt,27000,7,189000,21500,36,Yes,10000
2025-12-01,Yellow Garri (Paint),Tubers,Ibadan,5500,16,88000,4200,116,No,0
"Dec 02, 25",Dangote Sugar 1kg,Sweeteners,Lagos (Lekki),4000,29,116000,3200,178,No,0
2025-12-02,Power Oil (Sachet),Oils,Port Harcourt,500,14,7000,400,90,No,0
02-12-2025,Local Rice (50kg),Grains,Kano,120000,25,3000000,105000,182,Yes,50000
"Dec 02, 25",Yam Tuber (Large),Produce,Enugu,12000,16,192000,8000,104,Yes,5000
03/12/2025,Indomie Super Pack,Noodles,Abuja,20000,14,280000,16800,134,No,5000
2025-12-03,Yam Tuber (Large),Produce,Abuja,12000,13,156000,8000,69,Yes,5000
"Dec 03, 25",Power Oil (Sachet),Oils,Kano,500,7,3500,400,195,No,10000
"Dec 03, 25",Semovita 10kg,Swallow,Kano,NGN 10500,27,283500,9200,16,No,10000
04/12/2025,Yellow Garri (Paint),Tubers,Lagos (Ikeja),Promo Price: 5000,8,44000,4200,159,Yes,5000
2025.12.04,Power Oil (Sachet),Oils,Kano,500,10,5000,400,126,No,5000
"Dec 04, 25",Peak Milk 400g,Dairy,Enugu,5800,11,63800,4900,39,No,50000
04-12-2025,Beans Brown (Oloyin),Grains,Lagos (Ikeja),NGN 4500,5,22500,3200,189,No,10000
2025-12-05,Local Rice (50kg),Grains,Enugu,120000,24,2880000,105000,120,Yes,10000
05/12/2025,Local Rice (50kg),Grains,Lagos (Ikeja),120000,21,2520000,105000,44,No,5000
"Dec 05, 25",Indomie Super Pack,Noodles,Port Harcourt,20000,6,120000,16800,167,No,50000
05-12-2025,Yam Tuber (Large),Produce,Enugu,12000,3,36000,8000,17,No,0
06-12-2025,Peak Milk 400g,Dairy,Abuja,5800,29,168200,4900,200,No,0
2025.12.06,Yam Tuber (Large),Produce,Enugu,Promo Price: 11500,10,120000,8000,28,No,5000
2025-12-06,Local Rice (50kg),Grains,Lagos (Ikeja),120000,6,720000,105000,105,No,0
2025-12-06,Peak Milk 400g,Dairy,Ibadan,5800,16,92800,4900,179,No,0
"Dec 07, 25",Milo Refill 500g,Beverages,Kano,7200,18,129600,6000,35,Yes,5000
"Dec 07, 25",Local Rice (50kg),Grains,Lagos (Lekki),120000,0,0,105000,132,No,50000
2025.12.07,Local Rice (50kg),Grains,Enugu,120000,10,1200000,105000,181,No,10000
2025.12.07,Local Rice (50kg),Grains,Lagos (Lekki),120000,12,1440000,105000,160,No,0
"Dec 08, 25",Dangote Sugar 1kg,Sweeteners,Abuja,4000,5,20000,3200,122,No,0
2025.12.08,Local Rice (50kg),Grains,Lagos (Lekki),120000,29,3480000,105000,78,Yes,0
2025-12-08,Yam Tuber (Large),Produce,Lagos (Ikeja),12000,29,348000,8000,170,Yes,0
2025-12-08,Yam Tuber (Large),Produce,Port Harcourt,12000,28,336000,8000,63,No,0
2025.12.09,Yellow Garri (Paint),Tubers,Port Harcourt,5500,8,44000,4200,88,No,50000
2025.12.09,Semovita 10kg,Swallow,Lagos (Ikeja),Promo Price: 10000,-1,0,9200,171,Yes,10000
"Dec 09, 25",Dangote Sugar 1kg,Sweeteners,Enugu,Promo Price: 3500,23,92000,3200,101,Yes,10000
2025.12.09,Peak Milk 400g,Dairy,Lagos (Ikeja),5800,17,98600,4900,132,No,10000
2025-12-10,Peak Milk 400g,Dairy,Ibadan,5800,10,58000,4900,191,No,0
10/12/2025,Dangote Sugar 1kg,Sweeteners,Lagos (Lekki),4000,8,32000,3200,20,No,5000
10-12-2025,Kings Oil 5L,Oils,Enugu,27000,1,27000,21500,134,No,5000
10-12-2025,Frozen Turkey (kg),Meat,Enugu,11000,7,77000,8800,139,Yes,5000
"Dec 11, 25",Indomie Super Pack,Noodles,Port Harcourt,20000,2,40000,16800,145,Yes,5000
2025.12.11,Kings Oil 5L,Oils,Abuja,27000,12,324000,21500,95,No,10000
2025.12.11,Dangote Sugar 1kg,Sweeteners,Enugu,4000,-2,0,3200,124,No,0
11/12/2025,Yellow Garri (Paint),Tubers,Enugu,5500,10,55000,4200,18,No,0
2025.12.12,Local Rice (50kg),Grains,Abuja,120000,17,2040000,105000,106,No,0
2025.12.12,Peak Milk 400g,Dairy,Kano,5800,21,121800,4900,190,No,0
12-12-2025,Kings Oil 5L,Oils,Enugu,27000,13,351000,21500,106,No,0
12-12-2025,Yam Tuber (Large),Produce,Ibadan,12000,5,60000,8000,188,No,50000
"Dec 13, 25",Power Oil (Sachet),Oils,Lagos (Ikeja),500,19,9500,400,23,No,0
13-12-2025,Beans Brown (Oloyin),Grains,Ibadan,4500,3,13500,3200,62,No,5000
13-12-2025,Yellow Garri (Paint),Tubers,Lagos (Lekki),5500,0,0,4200,151,Yes,0
"Dec 13, 25",Milo Refill 500g,Beverages,Enugu,7200,30,216000,6000,104,No,50000
14-12-2025,Yellow Garri (Paint),Tubers,Enugu,5500,19,104500,4200,146,No,0
14/12/2025,Beans Brown (Oloyin),Grains,Lagos (Ikeja),Promo Price: 4000,27,121500,3200,31,No,50000
14-12-2025,Frozen Turkey (kg),Meat,Enugu,11000,11,121000,8800,187,Yes,10000
14-12-2025,Peak Milk 400g,Dairy,Kano,5800,26,150800,4900,90,No,0
15/12/2025,Local Rice (50kg),Grains,Port Harcourt,120000,3,360000,105000,42,No,0
2025.12.15,Kings Oil 5L,Oils,Lagos (Lekki),27000,6,162000,21500,176,No,0
15-12-2025,Beans Brown (Oloyin),Grains,Lagos (Lekki),Promo Price: 4000,15,67500,3200,84,No,5000
15-12-2025,Milo Refill 500g,Beverages,Abuja,7200,-2,0,6000,44,Yes,10000
"Dec 16, 25",Kings Oil 5L,Oils,Lagos (Lekki),27000,28,756000,21500,196,Yes,5000
16/12/2025,Yellow Garri (Paint),Tubers,Kano,5500,21,115500,4200,131,Yes,5000
16-12-2025,Local Rice (50kg),Grains,Lagos (Lekki),120000,20,2400000,105000,53,Yes,0
16/12/2025,Beans Brown (Oloyin),Grains,Ibadan,4500,28,126000,3200,108,No,0
2025-12-17,Local Rice (50kg),Grains,Kano,120000,14,1680000,105000,150,No,5000
2025-12-17,Milo Refill 500g,Beverages,Abuja,7200,4,28800,6000,58,Yes,5000
2025.12.17,Power Oil (Sachet),Oils,Enugu,500,13,6500,400,160,Yes,0
17/12/2025,Yellow Garri (Paint),Tubers,Abuja,5500,15,82500,4200,155,Yes,10000
18-12-2025,Beans Brown (Oloyin),Grains,Lagos (Ikeja),4500,29,130500,3200,190,No,10000
2025.12.18,Kings Oil 5L,Oils,Kano,NGN 27000,18,486000,21500,20,No,0
"Dec 18, 25",Indomie Super Pack,Noodles,Ibadan,20000,21,420000,16800,131,No,0
2025.12.18,Yam Tuber (Large),Produce,Lagos (Ikeja),12000,15,180000,8000,41,No,10000
19-12-2025,Yellow Garri (Paint),Tubers,Kano,5500,13,71500,4200,139,No,10000
2025.12.19,Local Rice (50kg),Grains,Enugu,120000,29,3480000,105000,55,No,0
2025-12-19,Yam Tuber (Large),Produce,Kano,12000,19,228000,8000,33,No,0
19-12-2025,Kings Oil 5L,Oils,Kano,27000,-2,0,21500,97,No,50000
"Dec 20, 25",Power Oil (Sachet),Oils,Port Harcourt,500,16,8000,400,118,No,0
2025-12-20,Kings Oil 5L,Oils,Ibadan,27000,11,297000,21500,121,No,10000
20/12/2025,Yellow Garri (Paint),Tubers,Kano,5500,27,148500,4200,91,No,50000
2025.12.20,Dangote Sugar 1kg,Sweeteners,Abuja,NGN 4000,9,36000,3200,158,No,50000
2025.12.21,Beans Brown (Oloyin),Grains,Port Harcourt,4500,17,76500,3200,166,No,10000
21-12-2025,Kings Oil 5L,Oils,Enugu,27000,0,0,21500,157,No,0
21/12/2025,Kings Oil 5L,Oils,Abuja,27000,10,270000,21500,88,Yes,0
2025-12-21,Frozen Turkey (kg),Meat,Port Harcourt,11000,19,209000,8800,119,No,0
22/12/2025,Indomie Super Pack,Noodles,Enugu,20000,1,20000,16800,112,No,10000
2025-12-22,Indomie Super Pack,Noodles,Lagos (Ikeja),20000,13,260000,16800,195,No,0
22-12-2025,Yellow Garri (Paint),Tubers,Abuja,5500,6,33000,4200,91,No,50000
"Dec 22, 25",Yam Tuber (Large),Produce,Lagos (Lekki),12000,24,288000,8000,181,Yes,0
2025-12-23,Kings Oil 5L,Oils,Ibadan,27000,-1,0,21500,105,No,10000
23-12-2025,Yam Tuber (Large),Produce,Lagos (Lekki),Promo Price: 11500,17,204000,8000,177,No,50000
23/12/2025,Indomie Super Pack,Noodles,Abuja,20000,13,260000,16800,190,No,0
"Dec 23, 25",Yam Tuber (Large),Produce,Port Harcourt,12000,9,108000,8000,84,No,0
24/12/2025,Semovita 10kg,Swallow,Lagos (Ikeja),10500,26,273000,9200,14,No,5000
2025.12.24,Yellow Garri (Paint),Tubers,Kano,NGN 5500,11,60500,4200,146,Yes,0
2025.12.24,Peak Milk 400g,Dairy,Kano,5800,0,0,4900,141,No,5000
2025.12.24,Semovita 10kg,Swallow,Lagos (Lekki),10500,-2,0,9200,113,No,0
2025.12.25,Indomie Super Pack,Noodles,Enugu,20000,3,60000,16800,154,Yes,5000
"Dec 25, 25",Yellow Garri (Paint),Tubers,Kano,5500,23,126500,4200,197,No,50000
"Dec 25, 25",Yam Tuber (Large),Produce,Abuja,12000,27,324000,8000,183,Yes,5000
25/12/2025,Dangote Sugar 1kg,Sweeteners,Lagos (Ikeja),4000,29,116000,3200,90,No,0
2025-12-26,Kings Oil 5L,Oils,Port Harcourt,NGN 27000,15,405000,21500,52,No,50000
2025.12.26,Indomie Super Pack,Noodles,Abuja,20000,13,260000,16800,38,Yes,10000
26/12/2025,Milo Refill 500g,Beverages,Abuja,7200,23,165600,6000,120,No,5000
26-12-2025,Dangote Sugar 1kg,Sweeteners,Kano,4000,14,56000,3200,55,No,0
27-12-2025,Yellow Garri (Paint),Tubers,Ibadan,5500,-2,0,4200,98,Yes,50000
2025-12-27,Peak Milk 400g,Dairy,Ibadan,5800,17,98600,4900,144,Yes,10000
2025.12.27,Beans Brown (Oloyin),Grains,Lagos (Lekki),4500,10,45000,3200,156,No,5000
2025-12-27,Frozen Turkey (kg),Meat,Enugu,11000,17,187000,8800,37,Yes,0
2025-12-28,Yam Tuber (Large),Produce,Kano,12000,28,336000,8000,97,No,0
28/12/2025,Milo Refill 500g,Beverages,Ibadan,7200,18,129600,6000,157,No,10000
2025.12.28,Semovita 10kg,Swallow,Lagos (Ikeja),10500,10,105000,9200,62,No,5000
2025-12-28,Yellow Garri (Paint),Tubers,Enugu,5500,9,49500,4200,157,Yes,5000
"Dec 29, 25",Yellow Garri (Paint),Tubers,Abuja,5500,13,71500,4200,197,No,50000
2025-12-29,Peak Milk 400g,Dairy,Lagos (Lekki),5800,7,40600,4900,78,Yes,10000
2025-12-29,Power Oil (Sachet),Oils,Lagos (Lekki),500,27,13500,400,10,No,0
2025-12-29,Yellow Garri (Paint),Tubers,Enugu,NGN 5500,1,5500,4200,82,No,0
"Dec 30, 25",Indomie Super Pack,Noodles,Kano,20000,28,560000,16800,194,No,0
"Dec 30, 25",Indomie Super Pack,Noodles,Kano,20000,1,20000,16800,67,No,50000
30/12/2025,Kings Oil 5L,Oils,Port Harcourt,27000,24,648000,21500,164,No,0
2025-12-30,Kings Oil 5L,Oils,Ibadan,27000,8,216000,21500,113,No,10000
31/12/2025,Milo Refill 500g,Beverages,Enugu,7200,2,14400,6000,72,No,10000
31/12/2025,Local Rice (50kg),Grains,Ibadan,120000,8,960000,105000,185,No,5000
2025.12.31,Indomie Super Pack,Noodles,Abuja,20000,15,300000,16800,66,Yes,0
2025-12-31,Yam Tuber (Large),Produce,Lagos (Ikeja),12000,2,24000,8000,59,No,0
01/01/2026,Yam Tuber (Large),Produce,Port Harcourt,12000,17,204000,8000,171,No,5000
"Jan 01, 26",Yam Tuber (Large),Produce,Ibadan,12000,4,48000,8000,72,Yes,10000
2026.01.01,Power Oil (Sachet),Oils,Abuja,500,28,14000,400,60,Yes,5000
01/01/2026,Semovita 10kg,Swallow,Kano,10500,15,157500,9200,78,Yes,0
02/01/2026,Yellow Garri (Paint),Tubers,Lagos (Lekki),5500,1,5500,4200,69,No,50000
"Jan 02, 26",Peak Milk 400g,Dairy,Kano,5800,27,156600,4900,179,No,50000
"Jan 02, 26",Power Oil (Sachet),Oils,Enugu,500,-2,0,400,36,No,0
02/01/2026,Semovita 10kg,Swallow,Port Harcourt,10500,21,220500,9200,171,No,0
2026-01-03,Milo Refill 500g,Beverages,Port Harcourt,7200,2,14400,6000,49,No,0
2026.01.03,Frozen Turkey (kg),Meat,Ibadan,11000,18,198000,8800,110,No,0
03/01/2026,Yellow Garri (Paint),Tubers,Abuja,5500,4,22000,4200,143,No,0
03-01-2026,Yellow Garri (Paint),Tubers,Lagos (Lekki),5500,15,82500,4200,161,No,0
2026-01-04,Power Oil (Sachet),Oils,Port Harcourt,500,23,11500,400,117,No,10000
"Jan 04, 26",Power Oil (Sachet),Oils,Kano,500,11,5500,400,95,Yes,50000
2026-01-04,Kings Oil 5L,Oils,Lagos (Lekki),27000,23,621000,21500,99,No,0
04-01-2026,Semovita 10kg,Swallow,Ibadan,10500,10,105000,9200,103,No,50000
05-01-2026,Semovita 10kg,Swallow,Ibadan,10500,28,294000,9200,150,No,0
"Jan 05, 26",Dangote Sugar 1kg,Sweeteners,Lagos (Ikeja),4000,14,56000,3200,93,Yes,10000
05-01-2026,Frozen Turkey (kg),Meat,Port Harcourt,11000,11,121000,8800,166,No,10000
"Jan 05, 26",Local Rice (50kg),Grains,Enugu,120000,18,2160000,105000,179,No,5000
2026.01.06,Yellow Garri (Paint),Tubers,Lagos (Lekki),5500,20,110000,4200,137,No,5000
06-01-2026,Beans Brown (Oloyin),Grains,Port Harcourt,4500,-1,0,3200,112,No,0
06-01-2026,Yellow Garri (Paint),Tubers,Ibadan,5500,9,49500,4200,197,No,10000
06-01-2026,Semovita 10kg,Swallow,Lagos (Ikeja),10500,-2,0,9200,49,Yes,5000
2026-01-07,Yellow Garri (Paint),Tubers,Enugu,5500,23,126500,4200,172,No,0
2026-01-07,Yellow Garri (Paint),Tubers,Lagos (Ikeja),5500,17,93500,4200,91,Yes,10000
07/01/2026,Semovita 10kg,Swallow,Ibadan,10500,-1,0,9200,109,Yes,0
2026.01.07,Kings Oil 5L,Oils,Ibadan,27000,28,756000,21500,113,No,5000
08-01-2026,Yellow Garri (Paint),Tubers,Lagos (Lekki),5500,28,154000,4200,67,No,0
"Jan 08, 26",Yam Tuber (Large),Produce,Lagos (Lekki),12000,2,24000,8000,24,Yes,10000
08-01-2026,Kings Oil 5L,Oils,Lagos (Lekki),27000,8,216000,21500,21,No,10000
2026.01.08,Milo Refill 500g,Beverages,Lagos (Ikeja),7200,29,208800,6000,59,No,50000
09/01/2026,Beans Brown (Oloyin),Grains,Lagos (Lekki),4500,14,63000,3200,111,Yes,0
"Jan 09, 26",Peak Milk 400g,Dairy,Ibadan,5800,30,174000,4900,113,Yes,10000
09/01/2026,Power Oil (Sachet),Oils,Port Harcourt,500,27,13500,400,33,No,50000
2026.01.09,Yellow Garri (Paint),Tubers,Lagos (Lekki),NGN 5500,27,148500,4200,53,No,5000
"Jan 10, 26",Local Rice (50kg),Grains,Ibadan,120000,18,2160000,105000,16,No,10000
10/01/2026,Peak Milk 400g,Dairy,Lagos (Lekki),NGN 5800,6,34800,4900,25,No,0
"Jan 10, 26",Frozen Turkey (kg),Meat,Lagos (Ikeja),11000,27,297000,8800,119,No,50000

10-01-2026,Yam Tuber (Large),Produce,Kano,12000,11,132000,8000,160,Yes,50000
